Campaign name,Ad Group Name,Ad Name,Date,Cost,CPC (Destination),CPM,Impression,Clicks (Destination),CTR (Destination),Conversions,CPA,Currency
K | ABO | 26-02-2024 | testing,Ad group 20240226111545,10 - ZYMUNO - EBLIETHOS - TM 10 (UDAH OK).mp4_2024-02-26 11:16:13,2024-02-26,1380,0,14838,93,0,0.0,0,0,IDR
K | ABO | 28-12-2023 | scale out,Ad group 20231228085134,2 KALI OP.mov_2023-12-28 08:52:22,2023-12-28,60756,3375,11491,5287,18,0.34,0,0,IDR
K | ABO | 28-12-2023 | scale out,Ad group 20231228085134,2 KALI OP.mov_2023-12-28 08:52:22,2023-12-29,83557,2881,13496,6191,29,0.47,1,83557,IDR
K | ABO | 28-12-2023 | scale out,Ad group 20231228085134,2 KALI OP.mov_2023-12-28 08:52:22,2023-12-30,159383,9961,175146,910,16,1.76,1,159383,IDR
K | ABO | 28-12-2023 | scale out,Ad group 20231228085134,2 KALI OP.mov_2023-12-28 08:52:22,2023-12-31,82568,5897,23337,3538,14,0.4,0,0,IDR
K | ABO | 28-12-2023 | scale out,Ad group 20231228085134,2 KALI OP.mov_2023-12-28 08:52:22,2024-01-01,82808,7528,28495,2906,11,0.38,0,0,IDR
K | ABO | 28-12-2023 | scale out,Ad group 20231228085134,2 KALI OP.mov_2023-12-28 08:52:22,2024-01-02,4983,4983,11222,444,1,0.23,0,0,IDR
K | ABO | 28-12-2023 | scale out,Ad group 20231228085134,2 KALI OP.mov_2023-12-28 08:52:22,2024-01-03,0,0,0,0,0,0.0,0,0,IDR
K | ABO | 28-12-2023 | scale out,Ad group 20231228085134,2 KALI OP.mov_2023-12-28 08:52:22,2024-01-04,0,0,0,0,0,0.0,0,0,IDR
K | ABO | 28-12-2023 | scale out,Ad group 20231228085134,2 KALI OP.mov_2023-12-28 08:52:22,2024-01-05,0,0,0,0,0,0.0,0,0,IDR
K | ABO | 28-12-2023 | scale out,Ad group 20231228085134,2 KALI OP.mov_2023-12-28 08:52:22,2024-01-06,0,0,0,0,0,0.0,0,0,IDR
K | ABO | 28-12-2023 | scale out,Ad group 20231228085134,2 KALI OP.mov_2023-12-28 08:52:22,2024-02-18,0,0,0,0,0,0.0,0,0,IDR
K | ABO | 01-11-2023 | testing,Ad group 20231101110340,2 TALENT.mov_2023-11-01 23:22:35,2023-11-02,14836,3709,10507,1412,4,0.28,0,0,IDR
K | ABO | 01-11-2023 | testing,Ad group 20231101110340,2 TALENT.mov_2023-11-01 23:22:35,2023-11-03,28080,3510,9298,3020,8,0.26,0,0,IDR
K | ABO | 01-11-2023 | testing,Ad group 20231101110340,2 TALENT.mov_2023-11-01 23:22:35,2023-11-04,9567,9567,13324,718,1,0.14,0,0,IDR
K | ABO | 01-11-2023 | testing,Ad group 20231101110340,2 TALENT.mov_2023-11-01 23:22:35,2023-11-05,0,0,0,0,0,0.0,0,0,IDR
Konversi 24 Juli 23 SCA,Ad group 20230630091924,2023-06-30 09:24:11_001,2023-06-30,511,0,7514,68,0,0.0,0,0,IDR
Konversi 24 Juli 23 SCA,Ad group 20230630091924,2023-06-30 09:24:11_001,2023-07-02,0,0,0,0,0,0.0,0,0,IDR
Konversi 24 Juli 23 SCA,Ad group 20230630091924,2023-06-30 09:24:11_002,2023-06-30,486,0,7476,65,0,0.0,0,0,IDR
Konversi 24 Juli 23 SCA,Ad group 20230630091924,2023-06-30 09:24:11_003,2023-06-30,69,0,4058,17,0,0.0,0,0,IDR
Konversi 24 Juli 23 SCA,Ad group 20230630091924,2023-06-30 09:24:11_004,2023-06-30,2444,0,11314,216,0,0.0,0,0,IDR
Konversi 24 Juli 23 SCA,Ad group 20230630091924,2023-06-30 09:24:11_005,2023-06-30,4523,4523,18845,240,1,0.42,0,0,IDR
Konversi 24 Juli 23 SCA,Ad group 20230630091924,2023-06-30 09:24:11_005,2023-07-01,0,0,0,0,0,0.0,0,0,IDR
Konversi 24 Juli 23 SCA,Ad group 20230630091924,2023-06-30 09:24:11_005,2023-07-04,0,0,0,0,0,0.0,0,0,IDR
Konversi 24 Juli 23 SCA,Ad group 20230630091924,2023-06-30 09:24:11_006,2023-06-30,630,0,7325,86,0,0.0,0,0,IDR
Konversi 24 Juli 23 SCA,Ad group 20230630091924,2023-06-30 09:24:11_006,2023-07-01,0,0,0,0,0,0.0,0,0,IDR
Konversi 24 Juli 23 SCA,Ad group 20230630091924,2023-06-30 09:24:11_010,2023-06-30,42051,3234,11192,3757,13,0.35,0,0,IDR
Konversi 24 Juli 23 SCA,Ad group 20230630091924,2023-06-30 09:24:11_010,2023-07-01,0,0,0,0,0,0.0,0,0,IDR
Konversi 24 Juli 23 SCA,Ad group 20230630091924,2023-06-30 09:24:11_010,2023-07-02,0,0,0,0,0,0.0,0,0,IDR
Konversi 24 Juli 23 SCA,Ad group 20230630091924,2023-06-30 09:24:11_010,2023-07-03,0,0,0,0,0,0.0,0,0,IDR
Konversi 24 Juli 23 SCA,Ad group 20230630091924,2023-06-30 09:24:11_010,2023-07-04,0,0,0,0,0,0.0,0,0,IDR
Konversi 24 Juli 23 SCA,Ad group 20230630091924,2023-06-30 09:24:11_010,2023-07-05,0,0,0,0,0,0.0,0,0,IDR
Konversi 24 Juli 23 SCA,Ad group 20230630091924,2023-06-30 09:24:11_011,2023-06-30,99773,3563,19621,5085,28,0.55,3,33257,IDR
Konversi 24 Juli 23 SCA,Ad group 20230630091924,2023-06-30 09:24:11_011,2023-07-01,0,0,0,0,0,0.0,0,0,IDR
Konversi 24 Juli 23 SCA,Ad group 20230630091924,2023-06-30 09:24:11_011,2023-07-02,0,0,0,0,0,0.0,0,0,IDR
Konversi 24 Juli 23 SCA,Ad group 20230630091924,2023-06-30 09:24:11_011,2023-07-03,0,0,0,0,0,0.0,0,0,IDR
Konversi 24 Juli 23 SCA,Ad group 20230630091924,2023-06-30 09:24:11_011,2023-07-04,0,0,0,0,0,0.0,0,0,IDR
Konversi 24 Juli 23 SCA,Ad group 20230630091924,2023-06-30 09:24:11_011,2023-07-05,0,0,0,0,0,0.0,0,0,IDR
Konversi 24 Juli 23 SCA,Ad group 20230630091924,2023-06-30 09:24:11_012,2023-06-30,16011,3202,29431,544,5,0.92,1,16011,IDR
Konversi 24 Juli 23 SCA,Ad group 20230630091924,2023-06-30 09:24:11_012,2023-07-01,0,0,0,0,0,0.0,0,0,IDR
Konversi 24 Juli 23 SCA,Ad group 20230630091924,2023-06-30 09:24:11_017,2023-07-24,66913,2389,11882,5631,28,0.5,0,0,IDR
Konversi 24 Juli 23 SCA,Ad group 20230630091924,2023-06-30 09:24:11_017,2023-07-25,150858,2601,11046,13657,58,0.42,3,50286,IDR
Konversi 24 Juli 23 SCA,Ad group 20230630091924,2023-06-30 09:24:11_017,2023-07-26,183658,3601,15019,12228,51,0.42,4,45914,IDR
Konversi 24 Juli 23 SCA,Ad group 20230630091924,2023-06-30 09:24:11_017,2023-07-27,58119,1490,7313,7947,39,0.49,0,0,IDR
Konversi 24 Juli 23 SCA,Ad group 20230630091924,2023-06-30 09:24:11_017,2023-07-28,274,137,4419,62,2,3.23,0,0,IDR
Konversi 24 Juli 23 SCA,Ad group 20230630091924,2023-06-30 09:24:11_017,2023-07-29,0,0,0,0,0,0.0,0,0,IDR
Konversi 24 Juli 23 SCA,Ad group 20230630091924,2023-06-30 09:24:11_017,2023-07-30,0,0,0,0,0,0.0,0,0,IDR
Konversi 24 Juli 23 SCA,Ad group 20230630091924,2023-06-30 09:24:11_017,2023-07-31,0,0,0,0,0,0.0,0,0,IDR
Konversi 24 Juli 23 SCA,Ad group 20230630091924,2023-06-30 09:24:11_017,2023-08-01,0,0,0,0,0,0.0,0,0,IDR
Konversi 24 Juli 23 SCA,Ad group 20230630091924,2023-06-30 09:24:11_018,2023-07-24,167524,2538,14284,11728,66,0.56,0,0,IDR
Konversi 24 Juli 23 SCA,Ad group 20230630091924,2023-06-30 09:24:11_018,2023-07-25,281351,2731,13154,21388,103,0.48,4,70337,IDR
Konversi 24 Juli 23 SCA,Ad group 20230630091924,2023-06-30 09:24:11_018,2023-07-26,336001,2823,16473,20397,119,0.58,3,112000,IDR
Konversi 24 Juli 23 SCA,Ad group 20230630091924,2023-06-30 09:24:11_018,2023-07-27,329300,1995,10157,32420,165,0.51,2,164650,IDR
Konversi 24 Juli 23 SCA,Ad group 20230630091924,2023-06-30 09:24:11_018,2023-07-28,1633,0,11500,142,0,0.0,0,0,IDR
Konversi 24 Juli 23 SCA,Ad group 20230630091924,2023-06-30 09:24:11_018,2023-07-29,0,0,0,0,0,0.0,0,0,IDR
Konversi 24 Juli 23 SCA,Ad group 20230630091924,2023-06-30 09:24:11_018,2023-07-30,0,0,0,0,0,0.0,0,0,IDR
Konversi 24 Juli 23 SCA,Ad group 20230630091924,2023-06-30 09:24:11_018,2023-07-31,0,0,0,0,0,0.0,0,0,IDR
Konversi 24 Juli 23 SCA,Ad group 20230630091924,2023-06-30 09:24:11_018,2023-08-01,0,0,0,0,0,0.0,0,0,IDR
Konversi 24 Juli 23 SCA,Ad group 20230630091924,2023-06-30 09:24:11_019,2023-07-24,5833,5833,16571,352,1,0.28,0,0,IDR
Konversi 24 Juli 23 SCA,Ad group 20230630091924,2023-06-30 09:24:11_019,2023-07-25,20626,5156,16607,1242,4,0.32,0,0,IDR
Konversi 24 Juli 23 SCA,Ad group 20230630091924,2023-06-30 09:24:11_019,2023-07-26,21265,10632,17854,1191,2,0.17,0,0,IDR
Konversi 24 Juli 23 SCA,Ad group 20230630091924,2023-06-30 09:24:11_019,2023-07-27,7241,1810,10433,694,4,0.58,0,0,IDR
Konversi 24 Juli 23 SCA,Ad group 20230630091924,2023-06-30 09:24:11_019,2023-07-28,15,0,7500,2,0,0.0,0,0,IDR
Konversi 24 Juli 23 SCA,Ad group 20230630091924,2023-06-30 09:24:11_019,2023-07-29,0,0,0,0,0,0.0,0,0,IDR
Konversi 24 Juli 23 SCA,Ad group 20230630091924,2023-06-30 09:24:11_019,2023-07-30,0,0,0,0,0,0.0,0,0,IDR
Konversi 24 Juli 23 SCA,Ad group 20230630091924,2023-06-30 09:24:11_019,2023-07-31,0,0,0,0,0,0.0,0,0,IDR
Konversi 24 Juli 23 SCA,Ad group 20230630091924,2023-06-30 09:24:11_019,2023-08-01,0,0,0,0,0,0.0,0,0,IDR
spark 19 Juli 23,Ad group 20230719010515,2023-07-19 13:06:38,2023-07-19,67739,4233,14010,4835,16,0.33,0,0,IDR
spark 19 Juli 23,Ad group 20230719010515,2023-07-19 13:06:38,2023-07-20,65202,4346,15520,4201,15,0.36,1,65202,IDR
spark 19 Juli 23,Ad group 20230719010515,2023-07-19 13:06:38,2023-07-21,46118,3547,13668,3374,13,0.39,0,0,IDR
spark 19 Juli 23,Ad group 20230719010515,2023-07-19 13:06:38,2023-07-22,16856,3371,19924,846,5,0.59,0,0,IDR
spark 19 Juli 23,Ad group 20230719010515,2023-07-19 13:06:38,2023-07-23,0,0,0,0,0,0.0,0,0,IDR
spark 19 Juli 23,Ad group 20230719010515,2023-07-19 13:06:38,2023-07-24,0,0,0,0,0,0.0,0,0,IDR
spark 19 Juli 23,Ad group 20230719010515,2023-07-19 13:06:38,2023-07-25,0,0,0,0,0,0.0,0,0,IDR
spark 19 Juli 23,Ad group 20230719010515,2023-07-19 13:06:38,2023-07-26,0,0,0,0,0,0.0,0,0,IDR
spark 19 Juli 23,Ad group 20230719010515,2023-07-19 13:07:29,2023-07-19,75918,4217,10358,7329,18,0.25,1,75918,IDR
spark 19 Juli 23,Ad group 20230719010515,2023-07-19 13:07:29,2023-07-19,31212,10404,7852,3975,3,0.08,0,0,IDR
spark 19 Juli 23,Ad group 20230719010515,2023-07-19 13:07:29,2023-07-20,134238,3121,13115,10235,43,0.42,2,67119,IDR
spark 19 Juli 23,Ad group 20230719010515,2023-07-19 13:07:29,2023-07-20,502,0,12550,40,0,0.0,0,0,IDR
spark 19 Juli 23,Ad group 20230719010515,2023-07-19 13:07:29,2023-07-21,153590,3490,12766,12031,44,0.37,1,153590,IDR
spark 19 Juli 23,Ad group 20230719010515,2023-07-19 13:07:29,2023-07-21,0,0,0,0,0,0.0,0,0,IDR
spark 19 Juli 23,Ad group 20230719010515,2023-07-19 13:07:29,2023-07-22,34356,4908,14557,2360,7,0.3,0,0,IDR
spark 19 Juli 23,Ad group 20230719010515,2023-07-19 13:07:29,2023-07-22,0,0,0,0,0,0.0,0,0,IDR
spark 19 Juli 23,Ad group 20230719010515,2023-07-19 13:07:29,2023-07-23,0,0,0,0,0,0.0,0,0,IDR
spark 19 Juli 23,Ad group 20230719010515,2023-07-19 13:07:29,2023-07-23,0,0,0,0,0,0.0,0,0,IDR
spark 19 Juli 23,Ad group 20230719010515,2023-07-19 13:07:29,2023-07-24,0,0,0,0,0,0.0,0,0,IDR
spark 19 Juli 23,Ad group 20230719010515,2023-07-19 13:07:29,2023-07-24,0,0,0,0,0,0.0,0,0,IDR
spark 19 Juli 23,Ad group 20230719010515,2023-07-19 13:07:29,2023-07-25,0,0,0,0,0,0.0,0,0,IDR
spark 19 Juli 23,Ad group 20230719010515,2023-07-19 13:07:29,2023-07-26,0,0,0,0,0,0.0,0,0,IDR
spark 19 Juli 23,Ad group 20230719010515,2023-07-19 13:07:29,2023-07-27,0,0,0,0,0,0.0,0,0,IDR
Konversi spark ads 05 agst 23,Ad group 20230805092356,2023-08-05 09:24:34,2023-08-05,28520,2592,6949,4104,11,0.27,0,0,IDR
Konversi spark ads 05 agst 23,Ad group 20230805092356,2023-08-05 09:24:34,2023-08-06,22335,1489,8034,2780,15,0.54,1,22335,IDR
Konversi spark ads 05 agst 23,Ad group 20230805092356,2023-08-05 09:24:34,2023-08-07,37481,2677,7983,4695,14,0.3,0,0,IDR
Konversi spark ads 05 agst 23,Ad group 20230805092356,2023-08-05 09:24:34,2023-08-08,21228,1769,11708,1813,12,0.66,0,0,IDR
Konversi spark ads 05 agst 23,Ad group 20230805092356,2023-08-05 09:24:34,2023-08-09,4010,4010,12531,320,1,0.31,0,0,IDR
Konversi spark ads 05 agst 23,Ad group 20230805092356,2023-08-05 09:24:34,2023-08-10,0,0,0,0,0,0.0,0,0,IDR
Konversi spark ads 05 agst 23,Ad group 20230805092356,2023-08-05 09:24:34,2023-08-11,0,0,0,0,0,0.0,0,0,IDR
Konversi spark ads 05 agst 23,Ad group 20230805092356,2023-08-05 09:24:34,2023-08-12,0,0,0,0,0,0.0,0,0,IDR
Konversi spark ads 05 agst 23,Ad group 20230805092356,2023-08-05 09:24:34,2023-08-13,0,0,0,0,0,0.0,0,0,IDR
Konversi spark ads 05 agst 23,Ad group 20230805092356,2023-08-05 09:24:44,2023-08-05,25701,6425,9281,2769,4,0.14,0,0,IDR
Konversi spark ads 05 agst 23,Ad group 20230805092356,2023-08-05 09:24:44,2023-08-06,9807,3269,7608,1289,3,0.23,0,0,IDR
Konversi spark ads 05 agst 23,Ad group 20230805092356,2023-08-05 09:24:44,2023-08-07,6645,1661,8508,781,4,0.51,1,6645,IDR
Konversi spark ads 05 agst 23,Ad group 20230805092356,2023-08-05 09:24:44,2023-08-08,10627,1771,13333,797,6,0.75,0,0,IDR
Konversi spark ads 05 agst 23,Ad group 20230805092356,2023-08-05 09:24:44,2023-08-09,22958,2869,12593,1823,8,0.44,0,0,IDR
Konversi spark ads 05 agst 23,Ad group 20230805092356,2023-08-05 09:24:44,2023-08-10,24556,3508,10602,2316,7,0.3,0,0,IDR
Konversi spark ads 05 agst 23,Ad group 20230805092356,2023-08-05 09:24:44,2023-08-11,3103,1034,9666,321,3,0.93,0,0,IDR
Konversi spark ads 05 agst 23,Ad group 20230805092356,2023-08-05 09:24:44,2023-08-12,0,0,0,0,0,0.0,0,0,IDR
Konversi spark ads 05 agst 23,Ad group 20230805092356,2023-08-05 09:24:44,2023-08-13,0,0,0,0,0,0.0,0,0,IDR
Konversi spark ads 05 agst 23,Ad group 20230805092356,2023-08-05 09:24:44,2023-08-14,0,0,0,0,0,0.0,0,0,IDR
Konversi spark ads 05 agst 23,Ad group 20230805092356,2023-08-05 09:24:44,2023-08-15,0,0,0,0,0,0.0,0,0,IDR
Konversi spark ads 05 agst 23,Ad group 20230805092356,2023-08-05 09:24:44,2023-08-16,0,0,0,0,0,0.0,0,0,IDR
K | ABO | 25-12-2023 | testing,Ad group 20231220020141,2023-12-24 21:00:45,2023-12-25,260203,2738,11830,21995,95,0.43,1,260203,IDR
K | ABO | 25-12-2023 | testing,Ad group 20231220020141,2023-12-24 21:00:45,2023-12-25,180597,2579,12099,14926,70,0.47,1,180597,IDR
K | ABO | 25-12-2023 | testing,Ad group 20231220020141,2023-12-24 21:00:45,2023-12-25,87669,1414,9854,8896,62,0.7,0,0,IDR
K | ABO | 25-12-2023 | testing,Ad group 20231220020141,2023-12-24 21:00:45,2023-12-25,63493,3023,11979,5300,21,0.4,2,31746,IDR
K | ABO | 25-12-2023 | testing,Ad group 20231220020141,2023-12-24 21:00:45,2023-12-25,8356,1671,7500,1114,5,0.45,0,0,IDR
K | ABO | 25-12-2023 | testing,Ad group 20231220020141,2023-12-24 21:00:45,2023-12-26,114568,1975,13196,8682,58,0.67,0,0,IDR
K | ABO | 25-12-2023 | testing,Ad group 20231220020141,2023-12-24 21:00:45,2023-12-26,110113,3336,22802,4829,33,0.68,0,0,IDR
K | ABO | 25-12-2023 | testing,Ad group 20231220020141,2023-12-24 21:00:45,2023-12-26,106537,2879,13750,7748,37,0.48,0,0,IDR
K | ABO | 25-12-2023 | testing,Ad group 20231220020141,2023-12-24 21:00:45,2023-12-26,61415,3838,12171,5046,16,0.32,0,0,IDR
K | ABO | 25-12-2023 | testing,Ad group 20231220020141,2023-12-24 21:00:45,2023-12-26,7765,1553,10071,771,5,0.65,0,0,IDR
K | ABO | 25-12-2023 | testing,Ad group 20231220020141,2023-12-24 21:00:45,2023-12-27,251296,2111,13732,18299,119,0.65,4,62824,IDR
K | ABO | 25-12-2023 | testing,Ad group 20231220020141,2023-12-24 21:00:45,2023-12-27,147127,3421,13878,10601,43,0.41,2,73563,IDR
K | ABO | 25-12-2023 | testing,Ad group 20231220020141,2023-12-24 21:00:45,2023-12-27,1350,0,10384,130,0,0.0,0,0,IDR
K | ABO | 25-12-2023 | testing,Ad group 20231220020141,2023-12-24 21:00:45,2023-12-27,485,0,20208,24,0,0.0,0,0,IDR
K | ABO | 25-12-2023 | testing,Ad group 20231220020141,2023-12-24 21:00:45,2023-12-27,103,0,9363,11,0,0.0,0,0,IDR
K | ABO | 25-12-2023 | testing,Ad group 20231220020141,2023-12-24 21:00:45,2023-12-28,362758,1374,9135,39709,264,0.66,5,72551,IDR
K | ABO | 25-12-2023 | testing,Ad group 20231220020141,2023-12-24 21:00:45,2023-12-28,45767,2408,14937,3064,19,0.62,1,45767,IDR
K | ABO | 25-12-2023 | testing,Ad group 20231220020141,2023-12-24 21:00:45,2023-12-28,405,0,8804,46,0,0.0,0,0,IDR
K | ABO | 25-12-2023 | testing,Ad group 20231220020141,2023-12-24 21:00:45,2023-12-28,0,0,0,0,0,0.0,0,0,IDR
K | ABO | 25-12-2023 | testing,Ad group 20231220020141,2023-12-24 21:00:45,2023-12-28,0,0,0,0,0,0.0,0,0,IDR
K | ABO | 25-12-2023 | testing,Ad group 20231220020141,2023-12-24 21:00:45,2023-12-29,310959,871,5695,54602,357,0.65,5,62191,IDR
K | ABO | 25-12-2023 | testing,Ad group 20231220020141,2023-12-24 21:00:45,2023-12-29,39300,2183,9857,3987,18,0.45,1,39300,IDR
K | ABO | 25-12-2023 | testing,Ad group 20231220020141,2023-12-24 21:00:45,2023-12-29,993,0,11413,87,0,0.0,0,0,IDR
K | ABO | 25-12-2023 | testing,Ad group 20231220020141,2023-12-24 21:00:45,2023-12-29,0,0,0,0,0,0.0,0,0,IDR
K | ABO | 25-12-2023 | testing,Ad group 20231220020141,2023-12-24 21:00:45,2023-12-29,0,0,0,0,0,0.0,0,0,IDR
K | ABO | 25-12-2023 | testing,Ad group 20231220020141,2023-12-24 21:00:45,2023-12-30,381025,1858,10752,35435,205,0.58,6,63504,IDR
K | ABO | 25-12-2023 | testing,Ad group 20231220020141,2023-12-24 21:00:45,2023-12-30,57111,4079,21831,2616,14,0.54,0,0,IDR
K | ABO | 25-12-2023 | testing,Ad group 20231220020141,2023-12-24 21:00:45,2023-12-30,923,0,10858,85,0,0.0,0,0,IDR
K | ABO | 25-12-2023 | testing,Ad group 20231220020141,2023-12-24 21:00:45,2023-12-30,0,0,0,0,0,0.0,0,0,IDR
K | ABO | 25-12-2023 | testing,Ad group 20231220020141,2023-12-24 21:00:45,2023-12-30,0,0,0,0,0,0.0,0,0,IDR
K | ABO | 25-12-2023 | testing,Ad group 20231220020141,2023-12-24 21:00:45,2023-12-31,284161,1457,6501,43709,195,0.45,2,142080,IDR
K | ABO | 25-12-2023 | testing,Ad group 20231220020141,2023-12-24 21:00:45,2023-12-31,34198,2137,7243,4721,16,0.34,0,0,IDR
K | ABO | 25-12-2023 | testing,Ad group 20231220020141,2023-12-24 21:00:45,2023-12-31,2393,0,7478,320,0,0.0,0,0,IDR
K | ABO | 25-12-2023 | testing,Ad group 20231220020141,2023-12-24 21:00:45,2023-12-31,0,0,0,0,0,0.0,0,0,IDR
K | ABO | 25-12-2023 | testing,Ad group 20231220020141,2023-12-24 21:00:45,2024-01-01,281593,1513,7861,35819,186,0.52,1,281593,IDR
K | ABO | 25-12-2023 | testing,Ad group 20231220020141,2023-12-24 21:00:45,2024-01-01,94577,3940,12622,7493,24,0.32,0,0,IDR
K | ABO | 25-12-2023 | testing,Ad group 20231220020141,2023-12-24 21:00:45,2024-01-01,7749,1937,14816,523,4,0.76,0,0,IDR
K | ABO | 25-12-2023 | testing,Ad group 20231220020141,2023-12-24 21:00:45,2024-01-01,0,0,0,0,0,0.0,0,0,IDR
K | ABO | 25-12-2023 | testing,Ad group 20231220020141,2023-12-24 21:00:45,2024-01-02,390725,1808,10424,37482,216,0.58,5,78145,IDR
K | ABO | 25-12-2023 | testing,Ad group 20231220020141,2023-12-24 21:00:45,2024-01-02,76532,3188,12525,6110,24,0.39,0,0,IDR
K | ABO | 25-12-2023 | testing,Ad group 20231220020141,2023-12-24 21:00:45,2024-01-02,31461,6292,15825,1988,5,0.25,0,0,IDR
K | ABO | 25-12-2023 | testing,Ad group 20231220020141,2023-12-24 21:00:45,2024-01-03,294590,1275,9292,31703,231,0.73,2,147295,IDR
K | ABO | 25-12-2023 | testing,Ad group 20231220020141,2023-12-24 21:00:45,2024-01-03,29631,3703,13617,2176,8,0.37,0,0,IDR
K | ABO | 25-12-2023 | testing,Ad group 20231220020141,2023-12-24 21:00:45,2024-01-03,0,0,0,0,0,0.0,0,0,IDR
K | ABO | 25-12-2023 | testing,Ad group 20231220020141,2023-12-24 21:00:45,2024-01-04,475944,1888,10269,46346,252,0.54,5,95188,IDR
K | ABO | 25-12-2023 | testing,Ad group 20231220020141,2023-12-24 21:00:45,2024-01-04,16502,5500,9946,1659,3,0.18,0,0,IDR
K | ABO | 25-12-2023 | testing,Ad group 20231220020141,2023-12-24 21:00:45,2024-01-04,0,0,0,0,0,0.0,0,0,IDR
K | ABO | 25-12-2023 | testing,Ad group 20231220020141,2023-12-24 21:00:45,2024-01-05,332746,1680,8712,38192,198,0.52,2,166373,IDR
K | ABO | 25-12-2023 | testing,Ad group 20231220020141,2023-12-24 21:00:45,2024-01-05,7412,2470,8588,863,3,0.35,0,0,IDR
K | ABO | 25-12-2023 | testing,Ad group 20231220020141,2023-12-24 21:00:45,2024-01-05,0,0,0,0,0,0.0,0,0,IDR
K | ABO | 25-12-2023 | testing,Ad group 20231220020141,2023-12-24 21:00:45,2024-01-06,285777,2342,11796,24226,122,0.5,1,285777,IDR
K | ABO | 25-12-2023 | testing,Ad group 20231220020141,2023-12-24 21:00:45,2024-01-06,14091,3522,12927,1090,4,0.37,0,0,IDR
K | ABO | 25-12-2023 | testing,Ad group 20231220020141,2023-12-24 21:00:45,2024-01-06,0,0,0,0,0,0.0,0,0,IDR
K | ABO | 25-12-2023 | testing,Ad group 20231220020141,2023-12-24 21:00:45,2024-01-07,311773,1924,10682,29185,162,0.56,2,155886,IDR
K | ABO | 25-12-2023 | testing,Ad group 20231220020141,2023-12-24 21:00:45,2024-01-07,29056,2421,10554,2753,12,0.44,0,0,IDR
K | ABO | 25-12-2023 | testing,Ad group 20231220020141,2023-12-24 21:00:45,2024-01-07,0,0,0,0,0,0.0,0,0,IDR
K | ABO | 25-12-2023 | testing,Ad group 20231220020141,2023-12-24 21:00:45,2024-01-08,258558,2462,10758,24032,105,0.44,1,258558,IDR
K | ABO | 25-12-2023 | testing,Ad group 20231220020141,2023-12-24 21:00:45,2024-01-08,76640,2642,12535,6114,29,0.47,2,38320,IDR
K | ABO | 25-12-2023 | testing,Ad group 20231220020141,2023-12-24 21:00:45,2024-01-08,0,0,0,0,0,0.0,0,0,IDR
K | ABO | 25-12-2023 | testing,Ad group 20231220020141,2023-12-24 21:00:45,2024-01-09,133621,3611,15122,8836,37,0.42,0,0,IDR
K | ABO | 25-12-2023 | testing,Ad group 20231220020141,2023-12-24 21:00:45,2024-01-09,112653,2964,13911,8098,38,0.47,1,112653,IDR
K | ABO | 25-12-2023 | testing,Ad group 20231220020141,2023-12-24 21:00:45,2024-01-10,35596,3559,14856,2396,10,0.42,0,0,IDR
K | ABO | 25-12-2023 | testing,Ad group 20231220020141,2023-12-24 21:00:45,2024-01-10,33814,3757,15163,2230,9,0.4,0,0,IDR
K | ABO | 25-12-2023 | testing,Ad group 20231220020141,2023-12-24 21:00:45,2024-01-10,0,0,0,0,0,0.0,0,0,IDR
K | ABO | 25-12-2023 | testing,Ad group 20231220020141,2023-12-24 21:00:45,2024-01-11,0,0,0,0,0,0.0,0,0,IDR
K | ABO | 25-12-2023 | testing,Ad group 20231220020141,2023-12-24 21:00:45,2024-01-11,0,0,0,0,0,0.0,0,0,IDR
K | ABO | 25-12-2023 | testing,Ad group 20231220020141,2023-12-24 21:00:45,2024-01-12,0,0,0,0,0,0.0,0,0,IDR
K | ABO | 25-12-2023 | testing,Ad group 20231220020141,2023-12-24 21:00:45,2024-01-12,0,0,0,0,0,0.0,0,0,IDR
K | ABO | 25-12-2023 | testing,Ad group 20231220020141,2023-12-24 21:00:45,2024-01-13,0,0,0,0,0,0.0,0,0,IDR
K | ABO | 25-12-2023 | testing,Ad group 20231220020141,2023-12-24 21:00:45,2024-01-13,0,0,0,0,0,0.0,0,0,IDR
K | ABO | 25-12-2023 | testing,Ad group 20231220020141,2023-12-24 21:00:45,2024-01-14,0,0,0,0,0,0.0,0,0,IDR
K | ABO | 25-12-2023 | testing,Ad group 20231220020141,2023-12-24 21:00:45,2024-01-14,0,0,0,0,0,0.0,0,0,IDR
K | ABO | 25-12-2023 | testing,Ad group 20231220020141,2023-12-24 21:00:45,2024-01-15,0,0,0,0,0,0.0,0,0,IDR
K | ABO | 25-12-2023 | testing,Ad group 20231220020141,2023-12-24 21:00:45,2024-01-15,0,0,0,0,0,0.0,0,0,IDR
K | ABO | 25-12-2023 | testing,Ad group 20231220020141,2023-12-24 21:00:45,2024-01-23,0,0,0,0,0,0.0,0,0,IDR
K | ABO | 25-12-2023 | testing,Ad group 20231220020141,2023-12-24 21:00:45,2024-02-10,0,0,0,0,0,0.0,0,0,IDR
K | ABO | 25-12-2023 | testing,Ad group 20231220020141,2023-12-24 21:00:45,2024-03-10,0,0,0,0,0,0.0,0,0,IDR
#ISU ZYMUNO,K | ABO | 01-03-2024 | testing,2024-03-01 14:02:46,2024-03-01,0,0,0,2,0,0.0,0,0,IDR
#ISU ZYMUNO,K | ABO | 01-03-2024 | testing,2024-03-01 14:02:58,2024-03-01,2342,0,9184,255,0,0.0,0,0,IDR
#ISU ZYMUNO,K | ABO | 01-03-2024 | testing,2024-03-01 14:02:58,2024-03-02,15,0,7500,2,0,0.0,0,0,IDR
#RAMADHAN ZYMUNO,K | ABO | 12-03-2024 | Ramadhan,2024-03-12 15:51:16,2024-03-12,43784,1903,10489,4174,23,0.55,0,0,IDR
#RAMADHAN ZYMUNO,K | ABO | 12-03-2024 | Ramadhan,2024-03-12 15:51:16,2024-03-12,8465,2821,10373,816,3,0.37,0,0,IDR
#RAMADHAN ZYMUNO,K | ABO | 12-03-2024 | Ramadhan,2024-03-12 15:51:16,2024-03-12,6618,3309,8628,767,2,0.26,0,0,IDR
#RAMADHAN ZYMUNO,K | ABO | 12-03-2024 | Ramadhan,2024-03-12 15:51:16,2024-03-13,51935,2885,9249,5615,18,0.32,1,51935,IDR
#RAMADHAN ZYMUNO,K | ABO | 12-03-2024 | Ramadhan,2024-03-12 15:51:16,2024-03-13,41609,3782,10984,3788,11,0.29,0,0,IDR
#RAMADHAN ZYMUNO,K | ABO | 12-03-2024 | Ramadhan,2024-03-12 15:51:16,2024-03-13,9790,890,8998,1088,11,1.01,0,0,IDR
#RAMADHAN ZYMUNO,K | ABO | 12-03-2024 | Ramadhan,2024-03-12 15:51:16,2024-03-14,0,0,0,0,0,0.0,0,0,IDR
#RAMADHAN ZYMUNO,K | ABO | 12-03-2024 | Ramadhan,2024-03-12 15:51:16,2024-03-14,0,0,0,0,0,0.0,0,0,IDR
#RAMADHAN ZYMUNO,K | ABO | 12-03-2024 | Ramadhan,2024-03-12 15:51:16,2024-03-14,0,0,0,0,0,0.0,0,0,IDR
#RAMADHAN ZYMUNO,K | ABO | 12-03-2024 | Ramadhan,2024-03-12 15:51:16,2024-03-15,0,0,0,0,0,0.0,0,0,IDR
#RAMADHAN ZYMUNO,K | ABO | 12-03-2024 | Ramadhan,2024-03-12 15:51:16,2024-03-15,0,0,0,0,0,0.0,0,0,IDR
#RAMADHAN ZYMUNO,K | ABO | 12-03-2024 | Ramadhan,2024-03-12 15:51:16,2024-03-15,0,0,0,0,0,0.0,0,0,IDR
#RAMADHAN ZYMUNO,K | ABO | 12-03-2024 | Ramadhan,2024-03-12 15:51:16,2024-03-16,0,0,0,0,0,0.0,0,0,IDR
#RAMADHAN ZYMUNO,K | ABO | 12-03-2024 | Ramadhan,2024-03-12 15:51:16,2024-03-16,0,0,0,0,0,0.0,0,0,IDR
#RAMADHAN ZYMUNO,K | ABO | 12-03-2024 | Ramadhan,2024-03-12 15:51:16,2024-03-16,0,0,0,0,0,0.0,0,0,IDR
#RAMADHAN ZYMUNO,K | ABO | 12-03-2024 | Ramadhan,2024-03-12 15:51:16,2024-03-17,0,0,0,0,0,0.0,0,0,IDR
#RAMADHAN ZYMUNO,K | ABO | 12-03-2024 | Ramadhan,2024-03-12 15:51:16,2024-03-17,0,0,0,0,0,0.0,0,0,IDR
#RAMADHAN ZYMUNO,K | ABO | 12-03-2024 | Ramadhan,2024-03-12 15:51:16,2024-03-17,0,0,0,0,0,0.0,0,0,IDR
#RAMADHAN ZYMUNO,K | ABO | 12-03-2024 | Ramadhan,2024-03-12 15:51:16,2024-03-18,0,0,0,0,0,0.0,0,0,IDR
#RAMADHAN ZYMUNO,K | ABO | 12-03-2024 | Ramadhan,2024-03-12 15:51:16,2024-03-18,0,0,0,0,0,0.0,0,0,IDR
K | ABO | 26-12-2023 | scale up,Ad group 20231226105341,2X SEHARI 2 SENDOK.mov_001,2023-12-26,74178,1766,7455,9949,42,0.42,0,0,IDR
K | ABO | 26-12-2023 | scale up,Ad group 20231226105341,2X SEHARI 2 SENDOK.mov_001,2023-12-27,0,0,0,0,0,0.0,0,0,IDR
K | ABO | 26-12-2023 | scale up,Ad group 20231226105341,2X SEHARI 2 SENDOK.mov_001,2023-12-28,0,0,0,0,0,0.0,0,0,IDR
K | ABO | 26-12-2023 | scale up,Ad group 20231226105341,2X SEHARI 2 SENDOK.mov_001,2023-12-29,0,0,0,0,0,0.0,0,0,IDR
K | ABO | 26-12-2023 | scale up,Ad group 20231226105341,2X SEHARI 2 SENDOK.mov_001,2023-12-30,0,0,0,0,0,0.0,0,0,IDR
K | ABO | 26-12-2023 | scale up,Ad group 20231226105341,2X SEHARI 2 SENDOK.mov_002,2023-12-26,26857,2065,7619,3525,13,0.37,2,13428,IDR
K | ABO | 26-12-2023 | scale up,Ad group 20231226105341,2X SEHARI 2 SENDOK.mov_002,2023-12-27,201772,1785,6508,31003,113,0.36,0,0,IDR
K | ABO | 26-12-2023 | scale up,Ad group 20231226105341,2X SEHARI 2 SENDOK.mov_002,2023-12-28,125772,1849,6515,19303,68,0.35,1,125772,IDR
K | ABO | 26-12-2023 | scale up,Ad group 20231226105341,2X SEHARI 2 SENDOK.mov_002,2023-12-29,155235,1568,6291,24674,99,0.4,0,0,IDR
K | ABO | 26-12-2023 | scale up,Ad group 20231226105341,2X SEHARI 2 SENDOK.mov_002,2023-12-30,36569,1741,9305,3930,21,0.53,0,0,IDR
K | ABO | 26-12-2023 | scale up,Ad group 20231226105341,2X SEHARI 2 SENDOK.mov_002,2023-12-31,0,0,0,0,0,0.0,0,0,IDR
K | ABO | 26-12-2023 | scale up,Ad group 20231226105341,2X SEHARI 2 SENDOK.mov_002,2024-01-01,0,0,0,0,0,0.0,0,0,IDR
K | ABO | 26-12-2023 | scale up,Ad group 20231226105341,2X SEHARI 2 SENDOK.mov_002,2024-01-02,0,0,0,0,0,0.0,0,0,IDR
K | ABO | 26-12-2023 | scale up,Ad group 20231226105341,2X SEHARI 2 SENDOK.mov_002,2024-01-03,0,0,0,0,0,0.0,0,0,IDR
K | ABO | 26-12-2023 | scale up,Ad group 20231226105341,2X SEHARI 2 SENDOK.mov_002,2024-02-17,0,0,0,0,0,0.0,0,0,IDR
K | ABO | 26-10-2023 |scale up,Ad group 20231026110946,2X SEHARI 2 SENDOK.mov_2023-10-26 11:10:23,2023-10-26,46152,2307,11675,3953,20,0.51,2,23076,IDR
K | ABO | 26-10-2023 |scale up,Ad group 20231026110946,2X SEHARI 2 SENDOK.mov_2023-10-26 11:10:23,2023-10-27,107554,2830,16855,6381,38,0.6,1,107554,IDR
K | ABO | 26-10-2023 |scale up,Ad group 20231026110946,2X SEHARI 2 SENDOK.mov_2023-10-26 11:10:23,2023-10-28,102865,2571,18685,5505,40,0.73,1,102865,IDR
K | ABO | 26-10-2023 |scale up,Ad group 20231026110946,2X SEHARI 2 SENDOK.mov_2023-10-26 11:10:23,2023-10-29,162276,2253,13020,12463,72,0.58,6,27046,IDR
K | ABO | 26-10-2023 |scale up,Ad group 20231026110946,2X SEHARI 2 SENDOK.mov_2023-10-26 11:10:23,2023-10-30,287427,3025,18337,15674,95,0.61,3,95809,IDR
K | ABO | 26-10-2023 |scale up,Ad group 20231026110946,2X SEHARI 2 SENDOK.mov_2023-10-26 11:10:23,2023-10-31,333948,4512,24580,13586,74,0.54,4,83487,IDR
K | ABO | 26-10-2023 |scale up,Ad group 20231026110946,2X SEHARI 2 SENDOK.mov_2023-10-26 11:10:23,2023-11-01,314765,2941,19440,16191,107,0.66,7,44966,IDR
K | ABO | 26-10-2023 |scale up,Ad group 20231026110946,2X SEHARI 2 SENDOK.mov_2023-10-26 11:10:23,2023-11-02,327677,3244,18978,17266,101,0.58,8,40959,IDR
K | ABO | 26-10-2023 |scale up,Ad group 20231026110946,2X SEHARI 2 SENDOK.mov_2023-10-26 11:10:23,2023-11-03,413337,2649,13501,30614,156,0.51,12,34444,IDR
K | ABO | 26-10-2023 |scale up,Ad group 20231026110946,2X SEHARI 2 SENDOK.mov_2023-10-26 11:10:23,2023-11-04,451401,1756,6660,67771,257,0.38,4,112850,IDR
K | ABO | 26-10-2023 |scale up,Ad group 20231026110946,2X SEHARI 2 SENDOK.mov_2023-10-26 11:10:23,2023-11-05,515769,2947,12091,42657,175,0.41,8,64471,IDR
K | ABO | 26-10-2023 |scale up,Ad group 20231026110946,2X SEHARI 2 SENDOK.mov_2023-10-26 11:10:23,2023-11-06,458064,3635,13193,34719,126,0.36,5,91612,IDR
K | ABO | 26-10-2023 |scale up,Ad group 20231026110946,2X SEHARI 2 SENDOK.mov_2023-10-26 11:10:23,2023-11-07,414401,3212,13282,31199,129,0.41,7,59200,IDR
K | ABO | 26-10-2023 |scale up,Ad group 20231026110946,2X SEHARI 2 SENDOK.mov_2023-10-26 11:10:23,2023-11-08,358610,3481,15846,22630,103,0.46,5,71722,IDR
K | ABO | 26-10-2023 |scale up,Ad group 20231026110946,2X SEHARI 2 SENDOK.mov_2023-10-26 11:10:23,2023-11-09,448295,2733,14075,31849,164,0.51,10,44829,IDR
K | ABO | 26-10-2023 |scale up,Ad group 20231026110946,2X SEHARI 2 SENDOK.mov_2023-10-26 11:10:23,2023-11-10,340417,3700,12354,27553,92,0.33,3,113472,IDR
K | ABO | 26-10-2023 |scale up,Ad group 20231026110946,2X SEHARI 2 SENDOK.mov_2023-10-26 11:10:23,2023-11-11,371462,2879,11459,32414,129,0.4,5,74292,IDR
K | ABO | 26-10-2023 |scale up,Ad group 20231026110946,2X SEHARI 2 SENDOK.mov_2023-10-26 11:10:23,2023-11-12,364320,2846,10887,33462,128,0.38,4,91080,IDR
K | ABO | 26-10-2023 |scale up,Ad group 20231026110946,2X SEHARI 2 SENDOK.mov_2023-10-26 11:10:23,2023-11-13,307261,2242,9559,32141,137,0.43,7,43894,IDR
K | ABO | 26-10-2023 |scale up,Ad group 20231026110946,2X SEHARI 2 SENDOK.mov_2023-10-26 11:10:23,2023-11-14,397514,2722,12408,32035,146,0.46,7,56787,IDR
K | ABO | 26-10-2023 |scale up,Ad group 20231026110946,2X SEHARI 2 SENDOK.mov_2023-10-26 11:10:23,2023-11-15,487454,3008,13121,37148,162,0.44,8,60931,IDR
K | ABO | 26-10-2023 |scale up,Ad group 20231026110946,2X SEHARI 2 SENDOK.mov_2023-10-26 11:10:23,2023-11-16,427542,2948,10982,38928,145,0.37,7,61077,IDR
K | ABO | 26-10-2023 |scale up,Ad group 20231026110946,2X SEHARI 2 SENDOK.mov_2023-10-26 11:10:23,2023-11-17,352786,2383,7795,45258,148,0.33,4,88196,IDR
K | ABO | 26-10-2023 |scale up,Ad group 20231026110946,2X SEHARI 2 SENDOK.mov_2023-10-26 11:10:23,2023-11-18,404486,2733,10099,40050,148,0.37,7,57783,IDR
K | ABO | 26-10-2023 |scale up,Ad group 20231026110946,2X SEHARI 2 SENDOK.mov_2023-10-26 11:10:23,2023-11-19,320333,1965,8977,35683,163,0.46,6,53388,IDR
K | ABO | 26-10-2023 |scale up,Ad group 20231026110946,2X SEHARI 2 SENDOK.mov_2023-10-26 11:10:23,2023-11-20,405135,1966,6230,65021,206,0.32,3,135045,IDR
K | ABO | 26-10-2023 |scale up,Ad group 20231026110946,2X SEHARI 2 SENDOK.mov_2023-10-26 11:10:23,2023-11-21,373246,2488,7602,49097,150,0.31,3,124415,IDR
K | ABO | 26-10-2023 |scale up,Ad group 20231026110946,2X SEHARI 2 SENDOK.mov_2023-10-26 11:10:23,2023-11-22,126217,3506,9576,13180,36,0.27,0,0,IDR
K | ABO | 26-10-2023 |scale up,Ad group 20231026110946,2X SEHARI 2 SENDOK.mov_2023-10-26 11:10:23,2023-11-23,0,0,0,0,0,0.0,0,0,IDR
K | ABO | 26-10-2023 |scale up,Ad group 20231026110946,2X SEHARI 2 SENDOK.mov_2023-10-26 11:10:23,2023-11-24,0,0,0,0,0,0.0,0,0,IDR
K | ABO | 26-10-2023 |scale up,Ad group 20231026110946,2X SEHARI 2 SENDOK.mov_2023-10-26 11:10:23,2023-11-25,0,0,0,0,0,0.0,0,0,IDR
K | ABO | 26-10-2023 |scale up,Ad group 20231026110946,2X SEHARI 2 SENDOK.mov_2023-10-26 11:10:23,2023-11-26,0,0,0,0,0,0.0,0,0,IDR
K | ABO | 26-10-2023 |scale up,Ad group 20231026110946,2X SEHARI 2 SENDOK.mov_2023-10-26 11:10:23,2023-11-27,0,0,0,0,0,0.0,0,0,IDR
K | ABO | 26-10-2023 |scale up,Ad group 20231026110946,2X SEHARI 2 SENDOK.mov_2023-10-26 11:10:23,2023-12-02,0,0,0,0,0,0.0,0,0,IDR
K | ABO | 26-10-2023 |scale up,Ad group 20231026110946,2X SEHARI 2 SENDOK.mov_2023-10-26 11:10:23,2023-12-08,0,0,0,0,0,0.0,0,0,IDR
K | ABO | 26-10-2023 |scale up,Ad group 20231026110946,2X SEHARI 2 SENDOK.mov_2023-10-26 11:10:23,2024-01-05,0,0,0,0,0,0.0,0,0,IDR
K | ABO | 22-01-2023 | scale out,Ad group 20240122031157,2X SEHARI 2 SENDOK.mov_2024-01-22 15:13:22,2024-01-22,557,0,7630,73,0,0.0,0,0,IDR
K | ABO | 22-01-2023 | scale out,Ad group 20240122031157,2X SEHARI 2 SENDOK.mov_2024-01-22 15:13:22,2024-01-23,31387,5231,12769,2458,6,0.24,0,0,IDR
K | ABO | 22-01-2023 | scale out,Ad group 20240122031157,2X SEHARI 2 SENDOK.mov_2024-01-22 15:13:22,2024-01-24,32540,1807,12457,2612,18,0.69,1,32540,IDR
K | ABO | 22-01-2023 | scale out,Ad group 20240122031157,2X SEHARI 2 SENDOK.mov_2024-01-22 15:13:22,2024-01-25,58138,3229,11184,5198,18,0.35,1,58138,IDR
K | ABO | 22-01-2023 | scale out,Ad group 20240122031157,2X SEHARI 2 SENDOK.mov_2024-01-22 15:13:22,2024-01-26,46373,3312,15416,3008,14,0.47,1,46373,IDR
K | ABO | 22-01-2023 | scale out,Ad group 20240122031157,2X SEHARI 2 SENDOK.mov_2024-01-22 15:13:22,2024-01-27,59065,3691,16085,3672,16,0.44,1,59065,IDR
K | ABO | 22-01-2023 | scale out,Ad group 20240122031157,2X SEHARI 2 SENDOK.mov_2024-01-22 15:13:22,2024-01-28,119346,3315,12307,9697,36,0.37,0,0,IDR
K | ABO | 22-01-2023 | scale out,Ad group 20240122031157,2X SEHARI 2 SENDOK.mov_2024-01-22 15:13:22,2024-01-29,76942,2959,12791,6015,26,0.43,1,76942,IDR
K | ABO | 22-01-2023 | scale out,Ad group 20240122031157,2X SEHARI 2 SENDOK.mov_2024-01-22 15:13:22,2024-01-30,85355,1778,13983,6104,48,0.79,3,28451,IDR
K | ABO | 22-01-2023 | scale out,Ad group 20240122031157,2X SEHARI 2 SENDOK.mov_2024-01-22 15:13:22,2024-01-31,112955,2214,9286,12164,51,0.42,1,112955,IDR
K | ABO | 22-01-2023 | scale out,Ad group 20240122031157,2X SEHARI 2 SENDOK.mov_2024-01-22 15:13:22,2024-02-01,166076,2050,10991,15109,81,0.54,2,83038,IDR
K | ABO | 22-01-2023 | scale out,Ad group 20240122031157,2X SEHARI 2 SENDOK.mov_2024-01-22 15:13:22,2024-02-02,255797,2610,13127,19485,98,0.5,3,85265,IDR
K | ABO | 22-01-2023 | scale out,Ad group 20240122031157,2X SEHARI 2 SENDOK.mov_2024-01-22 15:13:22,2024-02-03,299207,3022,10022,29853,99,0.33,0,0,IDR
K | ABO | 22-01-2023 | scale out,Ad group 20240122031157,2X SEHARI 2 SENDOK.mov_2024-01-22 15:13:22,2024-02-04,300020,2970,12671,23676,101,0.43,1,300020,IDR
K | ABO | 22-01-2023 | scale out,Ad group 20240122031157,2X SEHARI 2 SENDOK.mov_2024-01-22 15:13:22,2024-02-05,194242,2589,11962,16238,75,0.46,6,32373,IDR
K | ABO | 22-01-2023 | scale out,Ad group 20240122031157,2X SEHARI 2 SENDOK.mov_2024-01-22 15:13:22,2024-02-06,0,0,0,0,0,0.0,0,0,IDR
K | ABO | 22-01-2023 | scale out,Ad group 20240122031157,2X SEHARI 2 SENDOK.mov_2024-01-22 15:13:22,2024-02-07,0,0,0,0,0,0.0,0,0,IDR
K | ABO | 22-01-2023 | scale out,Ad group 20240122031157,2X SEHARI 2 SENDOK.mov_2024-01-22 15:13:22,2024-02-08,0,0,0,0,0,0.0,0,0,IDR
K | ABO | 22-01-2023 | scale out,Ad group 20240122031157,2X SEHARI 2 SENDOK.mov_2024-01-22 15:13:22,2024-02-09,0,0,0,0,0,0.0,0,0,IDR
K | ABO | 22-01-2023 | scale out,Ad group 20240122031157,2X SEHARI 2 SENDOK.mov_2024-01-22 15:13:22,2024-02-10,0,0,0,0,0,0.0,0,0,IDR
K | ABO | 22-01-2023 | scale out,Ad group 20240122031157,2X SEHARI 2 SENDOK.mov_2024-01-22 15:13:22,2024-02-13,0,0,0,0,0,0.0,0,0,IDR
K | ABO | 17-02-2024 | testing,"ID/18-55+/LLA VC 90, LLA PV 90 DAY/Balanced",2X SEHARI 2 SENDOK.mov_2024-02-17 09:50:17,2024-02-17,371880,1897,5749,64678,196,0.3,3,123960,IDR
K | ABO | 17-02-2024 | testing,"ID/18-55+/LLA VC 90, LLA PV 90 DAY/Balanced",2X SEHARI 2 SENDOK.mov_2024-02-17 09:50:17,2024-02-18,637304,1468,5370,118675,434,0.37,10,63730,IDR
K | ABO | 17-02-2024 | testing,"ID/18-55+/LLA VC 90, LLA PV 90 DAY/Balanced",2X SEHARI 2 SENDOK.mov_2024-02-17 09:50:17,2024-02-19,474908,1181,4808,98768,402,0.41,3,158302,IDR
K | ABO | 17-02-2024 | testing,"ID/18-55+/LLA VC 90, LLA PV 90 DAY/Balanced",2X SEHARI 2 SENDOK.mov_2024-02-17 09:50:17,2024-02-20,378159,1370,5670,66691,276,0.41,5,75631,IDR
K | ABO | 17-02-2024 | testing,"ID/18-55+/LLA VC 90, LLA PV 90 DAY/Balanced",2X SEHARI 2 SENDOK.mov_2024-02-17 09:50:17,2024-02-21,286070,2509,6780,42188,114,0.27,5,57214,IDR
K | ABO | 17-02-2024 | testing,"ID/18-55+/LLA VC 90, LLA PV 90 DAY/Balanced",2X SEHARI 2 SENDOK.mov_2024-02-17 09:50:17,2024-02-22,272232,2016,5743,47400,135,0.28,1,272232,IDR
K | ABO | 17-02-2024 | testing,"ID/18-55+/LLA VC 90, LLA PV 90 DAY/Balanced",2X SEHARI 2 SENDOK.mov_2024-02-17 09:50:17,2024-02-23,147925,1972,7636,19371,75,0.39,0,0,IDR
K | ABO | 17-02-2024 | testing,"ID/18-55+/LLA VC 90, LLA PV 90 DAY/Balanced",2X SEHARI 2 SENDOK.mov_2024-02-17 09:50:17,2024-02-24,0,0,0,0,0,0.0,0,0,IDR
K | ABO | 17-02-2024 | testing,"ID/18-55+/LLA VC 90, LLA PV 90 DAY/Balanced",2X SEHARI 2 SENDOK.mov_2024-02-17 09:50:17,2024-02-25,0,0,0,0,0,0.0,0,0,IDR
K | ABO | 17-02-2024 | testing,"ID/18-55+/LLA VC 90, LLA PV 90 DAY/Balanced",2X SEHARI 2 SENDOK.mov_2024-02-17 09:50:17,2024-02-26,0,0,0,0,0,0.0,0,0,IDR
K | ABO | 17-02-2024 | testing,"ID/18-55+/LLA VC 90, LLA PV 90 DAY/Balanced",2X SEHARI 2 SENDOK.mov_2024-02-17 09:50:17,2024-02-27,0,0,0,0,0,0.0,0,0,IDR
K | ABO | 17-02-2024 | testing,"ID/18-55+/LLA VC 90, LLA PV 90 DAY/Balanced",2X SEHARI 2 SENDOK.mov_2024-02-17 09:50:17,2024-02-28,0,0,0,0,0,0.0,0,0,IDR
K | ABO | 17-02-2024 | testing,"ID/18-55+/LLA VC 90, LLA PV 90 DAY/Balanced",2X SEHARI 2 SENDOK.mov_2024-02-17 09:50:17,2024-02-29,0,0,0,0,0,0.0,0,0,IDR
K | ABO | 17-02-2024 | testing,"ID/18-55+/LLA VC 90, LLA PV 90 DAY/Balanced",2X SEHARI 2 SENDOK.mov_2024-02-17 09:50:17,2024-03-02,0,0,0,0,0,0.0,0,0,IDR
K | ABO | 17-02-2024 | testing,"ID/18-55+/LLA VC 90, LLA PV 90 DAY/Balanced",2X SEHARI 2 SENDOK.mov_2024-02-17 09:50:17,2024-03-09,0,0,0,0,0,0.0,0,0,IDR
K | ABO | 17-02-2024 | testing,"ID/18-55+/LLA VC 90, LLA PV 90 DAY/Balanced",2X SEHARI 2 SENDOK.mov_2024-02-17 09:50:17,2024-03-11,0,0,0,0,0,0.0,0,0,IDR
K | ABO | 17-02-2024 | testing,"ID/18-55+/LLA VC 90, LLA PV 90 DAY/Balanced",2X SEHARI 2 SENDOK.mov_2024-02-17 09:50:17,2024-03-27,0,0,0,0,0,0.0,0,0,IDR
K | ABO | 06-11-2023 | testing,Ad group 20231106095934,2X sehari.mov_2023-11-06 10:00:51,2023-11-06,10337,5168,22230,465,2,0.43,0,0,IDR
K | ABO | 06-11-2023 | testing,Ad group 20231106095934,2X sehari.mov_2023-11-06 10:00:51,2023-11-07,5377,1792,19411,277,3,1.08,0,0,IDR
K | ABO | 06-11-2023 | testing,Ad group 20231106095934,2X sehari.mov_2023-11-06 10:00:51,2023-11-08,2523,0,14754,171,0,0.0,0,0,IDR
K | ABO | 06-11-2023 | testing,Ad group 20231106095934,2X sehari.mov_2023-11-06 10:00:51,2023-11-09,2729,909,6979,391,3,0.77,0,0,IDR
K | ABO | 06-11-2023 | testing,Ad group 20231106095934,2X sehari.mov_2023-11-06 10:00:51,2023-11-10,5621,2810,13709,410,2,0.49,0,0,IDR
K | ABO | 06-11-2023 | testing,Ad group 20231106095934,2X sehari.mov_2023-11-06 10:00:51,2023-11-11,3045,3045,14926,204,1,0.49,0,0,IDR
K | ABO | 06-11-2023 | testing,Ad group 20231106095934,2X sehari.mov_2023-11-06 10:00:51,2023-11-12,4344,4344,17950,242,1,0.41,0,0,IDR
K | ABO | 06-11-2023 | testing,Ad group 20231106095934,2X sehari.mov_2023-11-06 10:00:51,2023-11-13,5999,2999,12022,499,2,0.4,0,0,IDR
K | ABO | 06-11-2023 | testing,Ad group 20231106095934,2X sehari.mov_2023-11-06 10:00:51,2023-11-14,6579,1315,8819,746,5,0.67,0,0,IDR
K | ABO | 06-11-2023 | testing,Ad group 20231106095934,2X sehari.mov_2023-11-06 10:00:51,2023-11-15,7011,1752,7967,880,4,0.45,0,0,IDR
K | ABO | 06-11-2023 | testing,Ad group 20231106095934,2X sehari.mov_2023-11-06 10:00:51,2023-11-16,10244,5122,10783,950,2,0.21,0,0,IDR
K | ABO | 06-11-2023 | testing,Ad group 20231106095934,2X sehari.mov_2023-11-06 10:00:51,2023-11-17,1491,0,12221,122,0,0.0,0,0,IDR
K | ABO | 06-11-2023 | testing,Ad group 20231106095934,2X sehari.mov_2023-11-06 10:00:51,2023-11-18,0,0,0,0,0,0.0,0,0,IDR
K | ABO | 06-11-2023 | testing,Ad group 20231106095934,2X sehari.mov_2023-11-06 10:00:51,2023-11-19,0,0,0,0,0,0.0,0,0,IDR
K | ABO | 22-01-2024 | testing,Ad group 20240122032256,2_3 botol.mov_2024-01-22 15:23:54,2024-01-22,37983,1899,5909,6427,20,0.31,0,0,IDR
K | ABO | 22-01-2024 | testing,Ad group 20240122032256,2_3 botol.mov_2024-01-22 15:23:54,2024-01-23,13257,3314,6226,2129,4,0.19,0,0,IDR
K | ABO | 22-01-2024 | testing,Ad group 20240122032256,2_3 botol.mov_2024-01-22 15:23:54,2024-01-24,9824,4912,11370,864,2,0.23,0,0,IDR
K | ABO | 22-01-2024 | testing,Ad group 20240122032256,2_3 botol.mov_2024-01-22 15:23:54,2024-01-25,4591,4591,13154,349,1,0.29,0,0,IDR
K | ABO | 22-01-2024 | testing,Ad group 20240122032256,2_3 botol.mov_2024-01-22 15:23:54,2024-01-26,0,0,0,0,0,0.0,0,0,IDR
K | ABO | 22-01-2024 | testing,Ad group 20240122032256,2_3 botol.mov_2024-01-22 15:23:54,2024-01-27,0,0,0,0,0,0.0,0,0,IDR
K | ABO | 22-01-2024 | testing,Ad group 20240122032256,2_3 botol.mov_2024-01-22 15:23:54,2024-01-29,0,0,0,0,0,0.0,0,0,IDR
K | ABO | 22-01-2024 | testing,Ad group 20240122032256,2_3 botol.mov_2024-01-22 15:23:54,2024-01-31,0,0,0,0,0,0.0,0,0,IDR
K | ABO | 22-01-2024 | testing,Ad group 20240122032256,2_3 botol.mov_2024-01-22 15:23:54,2024-02-13,0,0,0,0,0,0.0,0,0,IDR
K | ABO | 15-03-2024 | testing,Ad group 20240315090537,2x sehari 2 sendok makan remake.mp4_2024-03-15 09:06:04,2024-03-15,125995,3149,10304,12227,40,0.33,2,62997,IDR
K | ABO | 15-03-2024 | testing,Ad group 20240315090537,2x sehari 2 sendok makan remake.mp4_2024-03-15 09:06:04,2024-03-16,132689,3685,12331,10760,36,0.33,1,132689,IDR
K | ABO | 15-03-2024 | testing,Ad group 20240315090537,2x sehari 2 sendok makan remake.mp4_2024-03-15 09:06:04,2024-03-17,199083,3432,13024,15285,58,0.38,2,99541,IDR
K | ABO | 15-03-2024 | testing,Ad group 20240315090537,2x sehari 2 sendok makan remake.mp4_2024-03-15 09:06:04,2024-03-18,269159,4893,13726,19609,55,0.28,1,269159,IDR
K | ABO | 15-03-2024 | testing,Ad group 20240315090537,2x sehari 2 sendok makan remake.mp4_2024-03-15 09:06:04,2024-03-19,64114,7123,12996,4933,9,0.18,0,0,IDR
K | ABO | 15-03-2024 | testing,Ad group 20240315090537,2x sehari 2 sendok makan remake.mp4_2024-03-15 09:06:04,2024-03-20,0,0,0,0,0,0.0,0,0,IDR
K | ABO | 15-03-2024 | testing,Ad group 20240315090537,2x sehari 2 sendok makan remake.mp4_2024-03-15 09:06:04,2024-03-21,0,0,0,0,0,0.0,0,0,IDR
K | ABO | 15-03-2024 | testing,Ad group 20240315090537,2x sehari 2 sendok makan remake.mp4_2024-03-15 09:06:04,2024-03-22,0,0,0,0,0,0.0,0,0,IDR
K | ABO | 15-03-2024 | testing,Ad group 20240315090537,2x sehari 2 sendok makan remake.mp4_2024-03-15 09:06:04,2024-03-23,0,0,0,0,0,0.0,0,0,IDR
K | ABO | 15-03-2024 | testing,Ad group 20240315090537,2x sehari 2 sendok makan remake.mp4_2024-03-15 09:06:04,2024-03-24,0,0,0,0,0,0.0,0,0,IDR
 K | ABO | 04-12-2023 | testing,Ad group 20231204091809,4 tahun ter.mov,2023-12-04,17383,5794,11107,1565,3,0.19,0,0,IDR
 K | ABO | 04-12-2023 | testing,Ad group 20231204091809,4 tahun ter.mov,2023-12-05,2654,0,9512,279,0,0.0,0,0,IDR
 K | ABO | 04-12-2023 | testing,Ad group 20231204091809,4 tahun ter.mov,2023-12-06,5619,1123,8155,689,5,0.73,0,0,IDR
 K | ABO | 04-12-2023 | testing,Ad group 20231204091809,4 tahun ter.mov,2023-12-07,2777,925,7120,390,3,0.77,0,0,IDR
 K | ABO | 04-12-2023 | testing,Ad group 20231204091809,4 tahun ter.mov,2023-12-08,6284,1571,9015,697,4,0.57,0,0,IDR
 K | ABO | 04-12-2023 | testing,Ad group 20231204091809,4 tahun ter.mov,2023-12-09,3623,1811,8309,436,2,0.46,0,0,IDR
 K | ABO | 04-12-2023 | testing,Ad group 20231204091809,4 tahun ter.mov,2023-12-10,2467,0,12586,196,0,0.0,0,0,IDR
 K | ABO | 04-12-2023 | testing,Ad group 20231204091809,4 tahun ter.mov,2023-12-11,1097,0,12325,89,0,0.0,0,0,IDR
 K | ABO | 04-12-2023 | testing,Ad group 20231204091809,4 tahun ter.mov,2023-12-12,1201,0,12776,94,0,0.0,0,0,IDR
 K | ABO | 04-12-2023 | testing,Ad group 20231204091809,4 tahun ter.mov,2023-12-13,1637,0,9802,167,0,0.0,0,0,IDR
 K | ABO | 04-12-2023 | testing,Ad group 20231204091809,4 tahun ter.mov,2023-12-14,2758,1379,14592,189,2,1.06,0,0,IDR
 K | ABO | 04-12-2023 | testing,Ad group 20231204091809,4 tahun ter.mov,2023-12-15,7977,1595,10071,792,5,0.63,0,0,IDR
 K | ABO | 04-12-2023 | testing,Ad group 20231204091809,4 tahun ter.mov,2023-12-16,10346,10346,11065,935,1,0.11,0,0,IDR
 K | ABO | 04-12-2023 | testing,Ad group 20231204091809,4 tahun ter.mov,2023-12-17,13377,2675,10710,1249,5,0.4,0,0,IDR
 K | ABO | 04-12-2023 | testing,Ad group 20231204091809,4 tahun ter.mov,2023-12-18,12383,2063,12898,960,6,0.63,0,0,IDR
 K | ABO | 04-12-2023 | testing,Ad group 20231204091809,4 tahun ter.mov,2023-12-19,4912,4912,23844,206,1,0.49,0,0,IDR
 K | ABO | 04-12-2023 | testing,Ad group 20231204091809,4 tahun ter.mov,2023-12-20,0,0,0,0,0,0.0,0,0,IDR
 K | ABO | 04-12-2023 | testing,Ad group 20231204091809,4 tahun ter.mov,2023-12-21,0,0,0,0,0,0.0,0,0,IDR
 K | ABO | 04-12-2023 | testing,Ad group 20231204091809,4 tahun ter.mov,2023-12-22,0,0,0,0,0,0.0,0,0,IDR
K | ABO | 26-02-2024 | testing,ID/18-54/Fairly Broad,5 - ZYMUNO - ETHOS - MANFAAT KHASIAT 5 (UDAH OK).mp4_2024-02-26 11:09:58,2024-02-26,179148,2454,13306,13463,73,0.54,2,89574,IDR
K | ABO | 26-02-2024 | testing,ID/18-54/Fairly Broad,5 - ZYMUNO - ETHOS - MANFAAT KHASIAT 5 (UDAH OK).mp4_2024-02-26 11:09:58,2024-02-27,180465,2313,11370,15872,78,0.49,4,45116,IDR
K | ABO | 26-02-2024 | testing,ID/18-54/Fairly Broad,5 - ZYMUNO - ETHOS - MANFAAT KHASIAT 5 (UDAH OK).mp4_2024-02-26 11:09:58,2024-02-28,172729,1515,6548,26378,114,0.43,0,0,IDR
K | ABO | 26-02-2024 | testing,ID/18-54/Fairly Broad,5 - ZYMUNO - ETHOS - MANFAAT KHASIAT 5 (UDAH OK).mp4_2024-02-26 11:09:58,2024-02-29,231708,2518,8258,28056,92,0.33,2,115854,IDR
K | ABO | 26-02-2024 | testing,ID/18-54/Fairly Broad,5 - ZYMUNO - ETHOS - MANFAAT KHASIAT 5 (UDAH OK).mp4_2024-02-26 11:09:58,2024-03-01,26049,2003,9534,2732,13,0.48,0,0,IDR
K | ABO | 26-02-2024 | testing,ID/18-54/Fairly Broad,5 - ZYMUNO - ETHOS - MANFAAT KHASIAT 5 (UDAH OK).mp4_2024-02-26 11:09:58,2024-03-02,0,0,0,0,0,0.0,0,0,IDR
K | ABO | 26-02-2024 | testing,ID/18-54/Fairly Broad,5 - ZYMUNO - ETHOS - MANFAAT KHASIAT 5 (UDAH OK).mp4_2024-02-26 11:09:58,2024-03-03,0,0,0,0,0,0.0,0,0,IDR
K | ABO | 26-02-2024 | testing,ID/18-54/Fairly Broad,5 - ZYMUNO - ETHOS - MANFAAT KHASIAT 5 (UDAH OK).mp4_2024-02-26 11:09:58,2024-03-04,0,0,0,0,0,0.0,0,0,IDR
K | ABO | 26-02-2024 | testing,ID/18-54/Fairly Broad,5 - ZYMUNO - ETHOS - MANFAAT KHASIAT 5 (UDAH OK).mp4_2024-02-26 11:09:58,2024-03-05,0,0,0,0,0,0.0,0,0,IDR
K | ABO | 26-02-2024 | testing,ID/18-54/Fairly Broad,5 - ZYMUNO - ETHOS - MANFAAT KHASIAT 5 (UDAH OK).mp4_2024-02-26 11:09:58,2024-03-08,0,0,0,0,0,0.0,0,0,IDR
Konversi 14 Agst 23,ad px2,7249630386204049410_2023-08-14 09:48:47,2023-08-14,117506,1335,7702,15256,88,0.58,0,0,IDR
Konversi 14 Agst 23,ad px2,7249630386204049410_2023-08-14 09:48:47,2023-08-15,135114,1080,7434,18174,125,0.69,0,0,IDR
Konversi 14 Agst 23,ad px2,7249630386204049410_2023-08-14 09:48:47,2023-08-16,25040,1252,7864,3184,20,0.63,0,0,IDR
Konversi 14 Agst 23,ad px2,7249630386204049410_2023-08-14 09:48:47,2023-08-17,0,0,0,0,0,0.0,0,0,IDR
Konversi 14 Agst 23,ad px2,7249630386204049410_2023-08-14 09:48:47,2023-08-18,0,0,0,0,0,0.0,0,0,IDR
Konversi 14 Agst 23,ad px2,7249630386204049410_2023-08-14 09:48:47,2023-08-19,0,0,0,0,0,0.0,0,0,IDR
Konversi 14 Agst 23,ad px2,7249630386204049410_2023-08-14 09:48:47,2023-08-20,0,0,0,0,0,0.0,0,0,IDR
Konversi 14 Agst 23,ad px2,7249630386204049410_2023-08-14 09:48:47,2023-08-31,0,0,0,0,0,0.0,0,0,IDR
K | ABO | 26-02-2024 | testing,ID/18-54/Fairly Broad,8 - ZYMUNO - EBLIETHOS - SV 8 (UDAH OK).mp4_2024-02-26 11:09:58,2024-02-26,39091,2057,6705,5830,19,0.33,1,39091,IDR
K | ABO | 26-02-2024 | testing,ID/18-54/Fairly Broad,8 - ZYMUNO - EBLIETHOS - SV 8 (UDAH OK).mp4_2024-02-26 11:09:58,2024-02-27,194535,1907,7165,27149,102,0.38,4,48633,IDR
K | ABO | 26-02-2024 | testing,ID/18-54/Fairly Broad,8 - ZYMUNO - EBLIETHOS - SV 8 (UDAH OK).mp4_2024-02-26 11:09:58,2024-02-28,67056,1915,5508,12173,35,0.29,2,33528,IDR
K | ABO | 26-02-2024 | testing,ID/18-54/Fairly Broad,8 - ZYMUNO - EBLIETHOS - SV 8 (UDAH OK).mp4_2024-02-26 11:09:58,2024-02-29,113708,1804,5494,20695,63,0.3,0,0,IDR
K | ABO | 26-02-2024 | testing,ID/18-54/Fairly Broad,8 - ZYMUNO - EBLIETHOS - SV 8 (UDAH OK).mp4_2024-02-26 11:09:58,2024-03-01,174151,1627,7307,23833,107,0.45,3,58050,IDR
K | ABO | 26-02-2024 | testing,ID/18-54/Fairly Broad,8 - ZYMUNO - EBLIETHOS - SV 8 (UDAH OK).mp4_2024-02-26 11:09:58,2024-03-02,199800,1800,6140,32538,111,0.34,2,99900,IDR
K | ABO | 26-02-2024 | testing,ID/18-54/Fairly Broad,8 - ZYMUNO - EBLIETHOS - SV 8 (UDAH OK).mp4_2024-02-26 11:09:58,2024-03-03,198869,2339,7404,26857,85,0.32,4,49717,IDR
K | ABO | 26-02-2024 | testing,ID/18-54/Fairly Broad,8 - ZYMUNO - EBLIETHOS - SV 8 (UDAH OK).mp4_2024-02-26 11:09:58,2024-03-04,163543,2070,5851,27947,79,0.28,2,81771,IDR
K | ABO | 26-02-2024 | testing,ID/18-54/Fairly Broad,8 - ZYMUNO - EBLIETHOS - SV 8 (UDAH OK).mp4_2024-02-26 11:09:58,2024-03-05,237754,1553,5154,46130,153,0.33,0,0,IDR
K | ABO | 26-02-2024 | testing,ID/18-54/Fairly Broad,8 - ZYMUNO - EBLIETHOS - SV 8 (UDAH OK).mp4_2024-02-26 11:09:58,2024-03-06,35063,1947,6133,5717,18,0.31,0,0,IDR
K | ABO | 26-02-2024 | testing,ID/18-54/Fairly Broad,8 - ZYMUNO - EBLIETHOS - SV 8 (UDAH OK).mp4_2024-02-26 11:09:58,2024-03-07,0,0,0,0,0,0.0,0,0,IDR
K | ABO | 26-02-2024 | testing,ID/18-54/Fairly Broad,8 - ZYMUNO - EBLIETHOS - SV 8 (UDAH OK).mp4_2024-02-26 11:09:58,2024-03-08,0,0,0,0,0,0.0,0,0,IDR
K | ABO | 26-02-2024 | testing,ID/18-54/Fairly Broad,8 - ZYMUNO - EBLIETHOS - SV 8 (UDAH OK).mp4_2024-02-26 11:09:58,2024-03-09,0,0,0,0,0,0.0,0,0,IDR
K | ABO | 26-02-2024 | testing,ID/18-54/Fairly Broad,8 - ZYMUNO - EBLIETHOS - SV 8 (UDAH OK).mp4_2024-02-26 11:09:58,2024-03-10,0,0,0,0,0,0.0,0,0,IDR
K | ABO | 26-02-2024 | testing,ID/18-54/Fairly Broad,8 - ZYMUNO - EBLIETHOS - SV 8 (UDAH OK).mp4_2024-02-26 11:09:58,2024-03-11,0,0,0,0,0,0.0,0,0,IDR
K | ABO | 26-02-2024 | testing,ID/18-54/Fairly Broad,8 - ZYMUNO - EBLIETHOS - SV 8 (UDAH OK).mp4_2024-02-26 11:09:58,2024-03-12,0,0,0,0,0,0.0,0,0,IDR
K | ABO | 26-02-2024 | testing,ID/18-54/Fairly Broad,8 - ZYMUNO - EBLIETHOS - SV 8 (UDAH OK).mp4_2024-02-26 11:09:58,2024-03-13,0,0,0,0,0,0.0,0,0,IDR
K | ABO | 26-02-2024 | testing,ID/18-54/Fairly Broad,8 - ZYMUNO - EBLIETHOS - SV 8 (UDAH OK).mp4_2024-02-26 11:09:58,2024-03-14,0,0,0,0,0,0.0,0,0,IDR
K | ABO | 26-02-2024 | testing,ID/18-54/Fairly Broad,8 - ZYMUNO - EBLIETHOS - SV 8 (UDAH OK).mp4_2024-02-26 11:09:58,2024-03-19,0,0,0,0,0,0.0,0,0,IDR
K | ABO | 26-02-2024 | testing,ID/18-54/Fairly Broad,8 - ZYMUNO - EBLIETHOS - SV 8 (UDAH OK).mp4_2024-02-26 11:09:58,2024-03-30,0,0,0,0,0,0.0,0,0,IDR
#ISU ZYMUNO,K | ABO | 01-03-2024 | testing,8 - ZYMUNO - EBLIETHOS - SV 8 (UDAH OK).mp4_2024-03-01 13:52:25,2024-03-01,138639,1631,7988,17354,85,0.49,1,138639,IDR
#ISU ZYMUNO,K | ABO | 01-03-2024 | testing,8 - ZYMUNO - EBLIETHOS - SV 8 (UDAH OK).mp4_2024-03-01 13:52:25,2024-03-02,53790,2151,9270,5802,25,0.43,1,53790,IDR
#ISU ZYMUNO,K | ABO | 01-03-2024 | testing,8 - ZYMUNO - EBLIETHOS - SV 8 (UDAH OK).mp4_2024-03-01 13:52:25,2024-03-03,0,0,0,0,0,0.0,0,0,IDR
#ISU ZYMUNO,K | ABO | 01-03-2024 | testing,8 - ZYMUNO - EBLIETHOS - SV 8 (UDAH OK).mp4_2024-03-01 13:52:25,2024-03-04,0,0,0,0,0,0.0,0,0,IDR
#ISU ZYMUNO,K | ABO | 01-03-2024 | testing,8 - ZYMUNO - EBLIETHOS - SV 8 (UDAH OK).mp4_2024-03-01 13:52:25,2024-03-05,0,0,0,0,0,0.0,0,0,IDR
#ISU ZYMUNO,K | ABO | 01-03-2024 | testing,8 - ZYMUNO - EBLIETHOS - SV 8 (UDAH OK).mp4_2024-03-01 13:52:25,2024-03-06,0,0,0,0,0,0.0,0,0,IDR
#ISU ZYMUNO,K | ABO | 01-03-2024 | testing,8 - ZYMUNO - EBLIETHOS - SV 8 (UDAH OK).mp4_2024-03-01 13:52:25,2024-03-07,0,0,0,0,0,0.0,0,0,IDR
K | ABO | 26-02-2024 | testing,Ad group 20240226111545,9 - ZYMUNO - EBLIETHOS - SV 9 (UDAH OK).mp4_2024-02-26 11:16:13,2024-02-26,9375,4687,12143,772,2,0.26,0,0,IDR
K | ABO | 26-02-2024 | testing,Ad group 20240226111545,9 - ZYMUNO - EBLIETHOS - SV 9 (UDAH OK).mp4_2024-02-26 11:16:13,2024-02-27,0,0,0,0,0,0.0,0,0,IDR
K | ABO | 26-02-2024 | testing,Ad group 20240226111545,9 - ZYMUNO - EBLIETHOS - SV 9 (UDAH OK).mp4_2024-02-26 11:16:13,2024-02-28,0,0,0,0,0,0.0,0,0,IDR
K | ABO | 26-02-2024 | testing,Ad group 20240226111545,9 - ZYMUNO - EBLIETHOS - SV 9 (UDAH OK).mp4_2024-02-26 11:16:13,2024-02-29,0,0,0,0,0,0.0,0,0,IDR
K | ABO | 26-02-2024 | testing,Ad group 20240226111545,9 - ZYMUNO - EBLIETHOS - SV 9 (UDAH OK).mp4_2024-02-26 11:16:13,2024-03-01,0,0,0,0,0,0.0,0,0,IDR
K | ABO | 23-12-2023 | testing,Ad group 20231223083440,ALFA TEST 2 (1).mov_2023-12-23 08:35:30,2023-12-23,125695,3808,12082,10403,33,0.32,0,0,IDR
K | ABO | 23-12-2023 | testing,Ad group 20231223083440,ALFA TEST 2 (1).mov_2023-12-23 08:35:30,2023-12-23,114928,3024,11952,9615,38,0.4,0,0,IDR
K | ABO | 23-12-2023 | testing,Ad group 20231223083440,ALFA TEST 2 (1).mov_2023-12-23 08:35:30,2023-12-24,109918,3925,16257,6761,28,0.41,0,0,IDR
K | ABO | 23-12-2023 | testing,Ad group 20231223083440,ALFA TEST 2 (1).mov_2023-12-23 08:35:30,2023-12-24,105715,2517,11712,9026,42,0.47,2,52857,IDR
K | ABO | 23-12-2023 | testing,Ad group 20231223083440,ALFA TEST 2 (1).mov_2023-12-23 08:35:30,2023-12-25,123402,1869,7084,17419,66,0.38,1,123402,IDR
K | ABO | 23-12-2023 | testing,Ad group 20231223083440,ALFA TEST 2 (1).mov_2023-12-23 08:35:30,2023-12-25,120703,1801,6860,17595,67,0.38,2,60351,IDR
K | ABO | 23-12-2023 | testing,Ad group 20231223083440,ALFA TEST 2 (1).mov_2023-12-23 08:35:30,2023-12-26,45561,1340,6340,7186,34,0.47,1,45561,IDR
K | ABO | 23-12-2023 | testing,Ad group 20231223083440,ALFA TEST 2 (1).mov_2023-12-23 08:35:30,2023-12-26,40560,1763,6979,5811,23,0.4,0,0,IDR
K | ABO | 23-12-2023 | testing,Ad group 20231223083440,ALFA TEST 2 (1).mov_2023-12-23 08:35:30,2023-12-27,0,0,0,0,0,0.0,0,0,IDR
K | ABO | 23-12-2023 | testing,Ad group 20231223083440,ALFA TEST 2 (1).mov_2023-12-23 08:35:30,2023-12-27,0,0,0,0,0,0.0,0,0,IDR
K | ABO | 23-12-2023 | testing,Ad group 20231223083440,ALFA TEST 2 (1).mov_2023-12-23 08:35:30,2023-12-28,0,0,0,0,0,0.0,0,0,IDR
K | ABO | 23-12-2023 | testing,Ad group 20231223083440,ALFA TEST 2 (1).mov_2023-12-23 08:35:30,2023-12-28,0,0,0,0,0,0.0,0,0,IDR
K | ABO | 23-12-2023 | testing,Ad group 20231223083440,ALFA TEST 2 (1).mov_2023-12-23 08:35:30,2023-12-29,0,0,0,0,0,0.0,0,0,IDR
K | ABO | 23-12-2023 | testing,Ad group 20231223083440,ALFA TEST 2 (1).mov_2023-12-23 08:35:30,2023-12-29,0,0,0,0,0,0.0,0,0,IDR
K | ABO | 23-12-2023 | testing,Ad group 20231223083440,ALFA TEST 2 (1).mov_2023-12-23 08:35:30,2023-12-30,0,0,0,0,0,0.0,0,0,IDR
K | ABO | 23-12-2023 | testing,Ad group 20231223083440,ALFA TEST 2 (1).mov_2023-12-23 08:35:30,2023-12-30,0,0,0,0,0,0.0,0,0,IDR
K | ABO | 23-12-2023 | testing,Ad group 20231223083440,ALFA TEST 2 (1).mov_2023-12-23 08:35:30,2023-12-31,0,0,0,0,0,0.0,0,0,IDR
K | ABO | 23-12-2023 | testing,Ad group 20231223083440,ALFA TEST 2 (1).mov_2023-12-23 08:35:30,2024-01-01,0,0,0,0,0,0.0,0,0,IDR
K | ABO | 23-12-2023 | testing,Ad group 20231223083440,ALFA TEST 2 (1).mov_2023-12-23 08:35:30,2024-03-01,0,0,0,0,0,0.0,0,0,IDR
K | ABO | 01-11-2023 | testing,Ad group 20231101110340,ALHAMDULILLAH rara.mov,2023-11-02,9811,3270,9950,986,3,0.3,0,0,IDR
K | ABO | 01-11-2023 | testing,Ad group 20231101110340,ALHAMDULILLAH rara.mov,2023-11-03,18497,2642,7804,2370,7,0.3,0,0,IDR
K | ABO | 01-11-2023 | testing,Ad group 20231101110340,ALHAMDULILLAH rara.mov,2023-11-04,16146,5382,8418,1918,3,0.16,0,0,IDR
K | ABO | 01-11-2023 | testing,Ad group 20231101110340,ALHAMDULILLAH rara.mov,2023-11-05,0,0,0,0,0,0.0,0,0,IDR
K | ABO | 01-11-2023 | testing,Ad group 20231101110340,ALHAMDULILLAH rara.mov,2023-11-06,0,0,0,0,0,0.0,0,0,IDR
K | ABO | 01-11-2023 | testing,Ad group 20231101110340,ALHAMDULILLAH rara.mov,2023-11-07,0,0,0,0,0,0.0,0,0,IDR
K | ABO | 01-11-2023 | testing,Ad group 20231101110340,ALHAMDULILLAH rara.mov,2023-11-08,0,0,0,0,0,0.0,0,0,IDR
K | ABO | 13-12-2023 | testing,Ad group 20231213021135,AMBEIEN KEMPES EMANG BISA.mov_2023-12-13 14:12:04,2023-12-13,65731,1264,5053,13008,52,0.4,1,65731,IDR
K | ABO | 13-12-2023 | testing,Ad group 20231213021135,AMBEIEN KEMPES EMANG BISA.mov_2023-12-13 14:12:04,2023-12-14,163712,1375,4771,34314,119,0.35,2,81856,IDR
K | ABO | 13-12-2023 | testing,Ad group 20231213021135,AMBEIEN KEMPES EMANG BISA.mov_2023-12-13 14:12:04,2023-12-15,157183,1786,5102,30808,88,0.29,1,157183,IDR
K | ABO | 13-12-2023 | testing,Ad group 20231213021135,AMBEIEN KEMPES EMANG BISA.mov_2023-12-13 14:12:04,2023-12-16,162443,2165,7071,22972,75,0.33,0,0,IDR
K | ABO | 13-12-2023 | testing,Ad group 20231213021135,AMBEIEN KEMPES EMANG BISA.mov_2023-12-13 14:12:04,2023-12-17,169947,2207,8626,19701,77,0.39,2,84973,IDR
K | ABO | 13-12-2023 | testing,Ad group 20231213021135,AMBEIEN KEMPES EMANG BISA.mov_2023-12-13 14:12:04,2023-12-18,52339,2492,11505,4549,21,0.46,0,0,IDR
K | ABO | 13-12-2023 | testing,Ad group 20231213021135,AMBEIEN KEMPES EMANG BISA.mov_2023-12-13 14:12:04,2023-12-19,0,0,0,0,0,0.0,0,0,IDR
K | ABO | 13-12-2023 | testing,Ad group 20231213021135,AMBEIEN KEMPES EMANG BISA.mov_2023-12-13 14:12:04,2023-12-20,0,0,0,0,0,0.0,0,0,IDR
K | ABO | 13-12-2023 | testing,Ad group 20231213021135,AMBEIEN KEMPES EMANG BISA.mov_2023-12-13 14:12:04,2023-12-21,0,0,0,0,0,0.0,0,0,IDR
K | ABO | 13-12-2023 | testing,Ad group 20231213021135,AMBEIEN KEMPES EMANG BISA.mov_2023-12-13 14:12:04,2023-12-22,0,0,0,0,0,0.0,0,0,IDR
K | ABO | 23-10-2023 | scale up,Ad group10,AMEL ORDER.MOV,2023-10-23,7102,3551,10875,653,2,0.31,0,0,IDR
K | ABO | 23-10-2023 | scale up,Ad group10,AMEL ORDER.MOV,2023-10-24,7648,1912,12120,631,4,0.63,1,7648,IDR
K | ABO | 23-10-2023 | scale up,Ad group10,AMEL ORDER.MOV,2023-10-25,4732,4732,7782,608,1,0.16,0,0,IDR
K | ABO | 23-10-2023 | scale up,Ad group10,AMEL ORDER.MOV,2023-10-26,4928,2464,6677,738,2,0.27,0,0,IDR
K | ABO | 23-10-2023 | scale up,Ad group10,AMEL ORDER.MOV,2023-10-27,4605,2302,6342,726,2,0.28,0,0,IDR
K | ABO | 23-10-2023 | scale up,Ad group10,AMEL ORDER.MOV,2023-10-28,4507,0,8819,511,0,0.0,0,0,IDR
K | ABO | 23-10-2023 | scale up,Ad group10,AMEL ORDER.MOV,2023-10-29,5560,2780,10220,544,2,0.37,0,0,IDR
K | ABO | 23-10-2023 | scale up,Ad group10,AMEL ORDER.MOV,2023-10-30,4930,2465,11465,430,2,0.47,0,0,IDR
K | ABO | 23-10-2023 | scale up,Ad group10,AMEL ORDER.MOV,2023-10-31,26728,2969,12160,2198,9,0.41,1,26728,IDR
K | ABO | 23-10-2023 | scale up,Ad group10,AMEL ORDER.MOV,2023-11-01,23800,7933,12223,1947,3,0.15,0,0,IDR
K | ABO | 23-10-2023 | scale up,Ad group10,AMEL ORDER.MOV,2023-11-02,10665,2666,14334,744,4,0.54,0,0,IDR
K | ABO | 23-10-2023 | scale up,Ad group10,AMEL ORDER.MOV,2023-11-03,7578,2526,15065,503,3,0.6,1,7578,IDR
K | ABO | 23-10-2023 | scale up,Ad group10,AMEL ORDER.MOV,2023-11-04,14359,2871,8940,1606,5,0.31,0,0,IDR
K | ABO | 23-10-2023 | scale up,Ad group10,AMEL ORDER.MOV,2023-11-05,12826,3206,12261,1046,4,0.38,0,0,IDR
K | ABO | 23-10-2023 | scale up,Ad group10,AMEL ORDER.MOV,2023-11-06,15596,15596,10830,1440,1,0.07,1,15596,IDR
K | ABO | 23-10-2023 | scale up,Ad group10,AMEL ORDER.MOV,2023-11-07,9691,2422,7226,1341,4,0.3,0,0,IDR
K | ABO | 23-10-2023 | scale up,Ad group10,AMEL ORDER.MOV,2023-11-08,11186,3728,12066,927,3,0.32,0,0,IDR
K | ABO | 23-10-2023 | scale up,Ad group10,AMEL ORDER.MOV,2023-11-09,23284,7761,11765,1979,3,0.15,0,0,IDR
K | ABO | 23-10-2023 | scale up,Ad group10,AMEL ORDER.MOV,2023-11-10,48742,4061,12386,3935,12,0.3,1,48742,IDR
K | ABO | 23-10-2023 | scale up,Ad group10,AMEL ORDER.MOV,2023-11-11,2048,2048,13562,151,1,0.66,0,0,IDR
K | ABO | 23-10-2023 | scale up,Ad group10,AMEL ORDER.MOV,2023-11-12,0,0,0,0,0,0.0,0,0,IDR
K | ABO | 23-10-2023 | scale up,Ad group10,AMEL ORDER.MOV,2023-11-13,0,0,0,0,0,0.0,0,0,IDR
K | ABO | 23-10-2023 | scale up,Ad group10,AMEL ORDER.MOV,2023-11-14,0,0,0,0,0,0.0,0,0,IDR
K | ABO | 23-10-2023 | scale up,Ad group10,AMEL ORDER.MOV,2023-11-15,0,0,0,0,0,0.0,0,0,IDR
K | ABO | 18-01-2023 | scale up,Ad group10,AMEL ORDER.MOV,2024-01-18,9774,9774,13316,734,1,0.14,0,0,IDR
K | ABO | 18-01-2023 | scale up,Ad group10,AMEL ORDER.MOV,2024-01-19,5001,2500,10617,471,2,0.42,0,0,IDR
K | ABO | 18-01-2023 | scale up,Ad group10,AMEL ORDER.MOV,2024-01-20,15812,3953,11491,1376,4,0.29,0,0,IDR
K | ABO | 18-01-2023 | scale up,Ad group10,AMEL ORDER.MOV,2024-01-21,14476,2068,8515,1700,7,0.41,0,0,IDR
K | ABO | 18-01-2023 | scale up,Ad group10,AMEL ORDER.MOV,2024-01-22,19663,2809,8328,2361,7,0.3,1,19663,IDR
K | ABO | 18-01-2023 | scale up,Ad group10,AMEL ORDER.MOV,2024-01-23,14407,2881,9422,1529,5,0.33,0,0,IDR
K | ABO | 18-01-2023 | scale up,Ad group10,AMEL ORDER.MOV,2024-01-24,30378,7594,15326,1982,4,0.2,1,30378,IDR
K | ABO | 18-01-2023 | scale up,Ad group10,AMEL ORDER.MOV,2024-01-25,3822,0,12531,305,0,0.0,0,0,IDR
K | ABO | 18-01-2023 | scale up,Ad group10,AMEL ORDER.MOV,2024-01-26,0,0,0,0,0,0.0,0,0,IDR
K | ABO | 18-01-2023 | scale up,Ad group10,AMEL ORDER.MOV,2024-01-27,0,0,0,0,0,0.0,0,0,IDR
K | ABO | 18-01-2023 | scale up,Ad group10,AMEL ORDER.MOV,2024-01-28,0,0,0,0,0,0.0,0,0,IDR
K | ABO | 18-01-2023 | scale up,Ad group10,AMEL ORDER.MOV,2024-01-29,0,0,0,0,0,0.0,0,0,IDR
K | ABO | 23-10-2023 | scale up,Ad group10,AMEL ORDER.MOV,2024-02-06,41258,3750,10570,3903,11,0.28,0,0,IDR
K | ABO | 23-10-2023 | scale up,Ad group10,AMEL ORDER.MOV,2024-02-07,60623,3031,9947,6094,20,0.33,0,0,IDR
K | ABO | 23-10-2023 | scale up,Ad group10,AMEL ORDER.MOV,2024-02-08,0,0,0,0,0,0.0,0,0,IDR
K | ABO | 23-10-2023 | scale up,Ad group10,AMEL ORDER.MOV,2024-02-09,0,0,0,0,0,0.0,0,0,IDR
K | ABO | 23-10-2023 | scale up,Ad group10,AMEL ORDER.MOV,2024-02-10,0,0,0,0,0,0.0,0,0,IDR
K | ABO | 23-10-2023 | scale up,Ad group10,AMEL ORDER.MOV,2024-02-11,0,0,0,0,0,0.0,0,0,IDR
K | ABO | 23-10-2023 | scale up,Ad group10,AMEL ORDER.MOV,2024-02-12,0,0,0,0,0,0.0,0,0,IDR
K | ABO | 16-11-2023 | scale up,Ad group 20231116110818,AWAL BINGUNG.mov_2023-11-16 11:13:03,2023-11-16,30372,6074,6931,4382,5,0.11,0,0,IDR
K | ABO | 16-11-2023 | scale up,Ad group 20231116110818,AWAL BINGUNG.mov_2023-11-16 11:13:03,2023-11-17,15369,1921,7188,2138,8,0.37,1,15369,IDR
K | ABO | 16-11-2023 | scale up,Ad group 20231116110818,AWAL BINGUNG.mov_2023-11-16 11:13:03,2023-11-18,12310,2051,5430,2267,6,0.26,0,0,IDR
K | ABO | 16-11-2023 | scale up,Ad group 20231116110818,AWAL BINGUNG.mov_2023-11-16 11:13:03,2023-11-19,15743,3148,6178,2548,5,0.2,1,15743,IDR
K | ABO | 16-11-2023 | scale up,Ad group 20231116110818,AWAL BINGUNG.mov_2023-11-16 11:13:03,2023-11-20,14128,4709,10719,1318,3,0.23,0,0,IDR
K | ABO | 16-11-2023 | scale up,Ad group 20231116110818,AWAL BINGUNG.mov_2023-11-16 11:13:03,2023-11-21,7400,2466,13577,545,3,0.55,0,0,IDR
K | ABO | 16-11-2023 | scale up,Ad group 20231116110818,AWAL BINGUNG.mov_2023-11-16 11:13:03,2023-11-22,4526,2263,12101,374,2,0.53,0,0,IDR
K | ABO | 16-11-2023 | scale up,Ad group 20231116110818,AWAL BINGUNG.mov_2023-11-16 11:13:03,2023-11-23,3887,1943,9124,426,2,0.47,0,0,IDR
K | ABO | 16-11-2023 | scale up,Ad group 20231116110818,AWAL BINGUNG.mov_2023-11-16 11:13:03,2023-11-24,4522,2261,12188,371,2,0.54,0,0,IDR
K | ABO | 16-11-2023 | scale up,Ad group 20231116110818,AWAL BINGUNG.mov_2023-11-16 11:13:03,2023-11-25,3558,0,12707,280,0,0.0,0,0,IDR
K | ABO | 16-11-2023 | scale up,Ad group 20231116110818,AWAL BINGUNG.mov_2023-11-16 11:13:03,2023-11-26,2034,2034,13470,151,1,0.66,0,0,IDR
K | ABO | 16-11-2023 | scale up,Ad group 20231116110818,AWAL BINGUNG.mov_2023-11-16 11:13:03,2023-11-27,1417,0,11070,128,0,0.0,0,0,IDR
K | ABO | 16-11-2023 | scale up,Ad group 20231116110818,AWAL BINGUNG.mov_2023-11-16 11:13:03,2023-11-28,5419,2709,10925,496,2,0.4,0,0,IDR
K | ABO | 16-11-2023 | scale up,Ad group 20231116110818,AWAL BINGUNG.mov_2023-11-16 11:13:03,2023-11-29,3468,1156,9102,381,3,0.79,0,0,IDR
K | ABO | 16-11-2023 | scale up,Ad group 20231116110818,AWAL BINGUNG.mov_2023-11-16 11:13:03,2023-11-30,2174,1087,8234,264,2,0.76,0,0,IDR
K | ABO | 16-11-2023 | scale up,Ad group 20231116110818,AWAL BINGUNG.mov_2023-11-16 11:13:03,2023-12-01,29,0,4142,7,0,0.0,0,0,IDR
K | ABO | 16-11-2023 | scale up,Ad group 20231116110818,AWAL BINGUNG.mov_2023-11-16 11:13:03,2023-12-02,1566,0,13982,112,0,0.0,0,0,IDR
K | ABO | 16-11-2023 | scale up,Ad group 20231116110818,AWAL BINGUNG.mov_2023-11-16 11:13:03,2023-12-03,493,0,7144,69,0,0.0,0,0,IDR
K | ABO | 16-11-2023 | scale up,Ad group 20231116110818,AWAL BINGUNG.mov_2023-11-16 11:13:03,2023-12-04,754,0,9921,76,0,0.0,0,0,IDR
K | ABO | 16-11-2023 | scale up,Ad group 20231116110818,AWAL BINGUNG.mov_2023-11-16 11:13:03,2023-12-05,131,0,5695,23,0,0.0,0,0,IDR
K | ABO | 16-11-2023 | scale up,Ad group 20231116110818,AWAL BINGUNG.mov_2023-11-16 11:13:03,2023-12-06,1238,1238,37515,33,1,3.03,0,0,IDR
K | ABO | 16-11-2023 | scale up,Ad group 20231116110818,AWAL BINGUNG.mov_2023-11-16 11:13:03,2023-12-07,3602,0,3775,954,0,0.0,0,0,IDR
K | ABO | 16-11-2023 | scale up,Ad group 20231116110818,AWAL BINGUNG.mov_2023-11-16 11:13:03,2023-12-08,11770,2354,8335,1412,5,0.35,0,0,IDR
K | ABO | 16-11-2023 | scale up,Ad group 20231116110818,AWAL BINGUNG.mov_2023-11-16 11:13:03,2023-12-09,5505,2752,11257,489,2,0.41,0,0,IDR
K | ABO | 16-11-2023 | scale up,Ad group 20231116110818,AWAL BINGUNG.mov_2023-11-16 11:13:03,2023-12-10,5865,0,18619,315,0,0.0,0,0,IDR
K | ABO | 16-11-2023 | scale up,Ad group 20231116110818,AWAL BINGUNG.mov_2023-11-16 11:13:03,2023-12-11,5392,0,16489,327,0,0.0,0,0,IDR
K | ABO | 16-11-2023 | scale up,Ad group 20231116110818,AWAL BINGUNG.mov_2023-11-16 11:13:03,2023-12-12,5015,0,17534,286,0,0.0,0,0,IDR
K | ABO | 16-11-2023 | scale up,Ad group 20231116110818,AWAL BINGUNG.mov_2023-11-16 11:13:03,2023-12-13,6536,6536,10292,635,1,0.16,0,0,IDR
K | ABO | 16-11-2023 | scale up,Ad group 20231116110818,AWAL BINGUNG.mov_2023-11-16 11:13:03,2023-12-14,5621,5621,13479,417,1,0.24,0,0,IDR
K | ABO | 16-11-2023 | scale up,Ad group 20231116110818,AWAL BINGUNG.mov_2023-11-16 11:13:03,2023-12-15,10529,3509,17120,615,3,0.49,0,0,IDR
K | ABO | 16-11-2023 | scale up,Ad group 20231116110818,AWAL BINGUNG.mov_2023-11-16 11:13:03,2023-12-16,13730,2746,8485,1618,5,0.31,0,0,IDR
K | ABO | 16-11-2023 | scale up,Ad group 20231116110818,AWAL BINGUNG.mov_2023-11-16 11:13:03,2023-12-17,36203,2784,12902,2806,13,0.46,0,0,IDR
K | ABO | 16-11-2023 | scale up,Ad group 20231116110818,AWAL BINGUNG.mov_2023-11-16 11:13:03,2023-12-18,21713,5428,15162,1432,4,0.28,0,0,IDR
K | ABO | 16-11-2023 | scale up,Ad group 20231116110818,AWAL BINGUNG.mov_2023-11-16 11:13:03,2023-12-19,14864,1858,12618,1178,8,0.68,0,0,IDR
K | ABO | 16-11-2023 | scale up,Ad group 20231116110818,AWAL BINGUNG.mov_2023-11-16 11:13:03,2023-12-20,13155,6577,14764,891,2,0.22,0,0,IDR
K | ABO | 16-11-2023 | scale up,Ad group 20231116110818,AWAL BINGUNG.mov_2023-11-16 11:13:03,2023-12-21,4388,4388,11923,368,1,0.27,0,0,IDR
K | ABO | 16-11-2023 | scale up,Ad group 20231116110818,AWAL BINGUNG.mov_2023-11-16 11:13:03,2023-12-22,1370,0,9647,142,0,0.0,0,0,IDR
K | ABO | 16-11-2023 | scale up,Ad group 20231116110818,AWAL BINGUNG.mov_2023-11-16 11:13:03,2023-12-23,1445,1445,11377,127,1,0.79,0,0,IDR
K | ABO | 16-11-2023 | scale up,Ad group 20231116110818,AWAL BINGUNG.mov_2023-11-16 11:13:03,2023-12-24,908,0,9080,100,0,0.0,0,0,IDR
K | ABO | 16-11-2023 | scale up,Ad group 20231116110818,AWAL BINGUNG.mov_2023-11-16 11:13:03,2023-12-25,1428,0,10736,133,0,0.0,0,0,IDR
K | ABO | 16-11-2023 | scale up,Ad group 20231116110818,AWAL BINGUNG.mov_2023-11-16 11:13:03,2023-12-26,3136,3136,13694,229,1,0.44,0,0,IDR
K | ABO | 16-11-2023 | scale up,Ad group 20231116110818,AWAL BINGUNG.mov_2023-11-16 11:13:03,2023-12-27,1792,1792,7964,225,1,0.44,0,0,IDR
K | ABO | 16-11-2023 | scale up,Ad group 20231116110818,AWAL BINGUNG.mov_2023-11-16 11:13:03,2023-12-28,845,0,6983,121,0,0.0,0,0,IDR
K | ABO | 16-11-2023 | scale up,Ad group 20231116110818,AWAL BINGUNG.mov_2023-11-16 11:13:03,2023-12-29,4136,2068,8173,506,2,0.4,0,0,IDR
K | ABO | 16-11-2023 | scale up,Ad group 20231116110818,AWAL BINGUNG.mov_2023-11-16 11:13:03,2023-12-30,2876,2876,10162,283,1,0.35,0,0,IDR
K | ABO | 16-11-2023 | scale up,Ad group 20231116110818,AWAL BINGUNG.mov_2023-11-16 11:13:03,2023-12-31,1459,0,13764,106,0,0.0,0,0,IDR
K | ABO | 16-11-2023 | scale up,Ad group 20231116110818,AWAL BINGUNG.mov_2023-11-16 11:13:03,2024-01-01,2055,2055,8973,229,1,0.44,0,0,IDR
K | ABO | 16-11-2023 | scale up,Ad group 20231116110818,AWAL BINGUNG.mov_2023-11-16 11:13:03,2024-01-02,2613,0,8401,311,0,0.0,0,0,IDR
K | ABO | 16-11-2023 | scale up,Ad group 20231116110818,AWAL BINGUNG.mov_2023-11-16 11:13:03,2024-01-03,1050,0,6774,155,0,0.0,0,0,IDR
K | ABO | 16-11-2023 | scale up,Ad group 20231116110818,AWAL BINGUNG.mov_2023-11-16 11:13:03,2024-01-04,67506,1985,7540,8953,34,0.38,0,0,IDR
K | ABO | 16-11-2023 | scale up,Ad group 20231116110818,AWAL BINGUNG.mov_2023-11-16 11:13:03,2024-01-05,173289,2987,9465,18307,58,0.32,0,0,IDR
K | ABO | 16-11-2023 | scale up,Ad group 20231116110818,AWAL BINGUNG.mov_2023-11-16 11:13:03,2024-01-06,46120,4612,14969,3081,10,0.32,0,0,IDR
K | ABO | 16-11-2023 | scale up,Ad group 20231116110818,AWAL BINGUNG.mov_2023-11-16 11:13:03,2024-01-07,53319,4847,18025,2958,11,0.37,0,0,IDR
K | ABO | 16-11-2023 | scale up,Ad group 20231116110818,AWAL BINGUNG.mov_2023-11-16 11:13:03,2024-01-08,26050,2894,8625,3020,9,0.3,0,0,IDR
K | ABO | 16-11-2023 | scale up,Ad group 20231116110818,AWAL BINGUNG.mov_2023-11-16 11:13:03,2024-01-09,31063,3882,11878,2615,8,0.31,0,0,IDR
K | ABO | 16-11-2023 | scale up,Ad group 20231116110818,AWAL BINGUNG.mov_2023-11-16 11:13:03,2024-01-10,23614,7871,10733,2200,3,0.14,0,0,IDR
K | ABO | 16-11-2023 | scale up,Ad group 20231116110818,AWAL BINGUNG.mov_2023-11-16 11:13:03,2024-01-11,31526,6305,11393,2767,5,0.18,0,0,IDR
K | ABO | 16-11-2023 | scale up,Ad group 20231116110818,AWAL BINGUNG.mov_2023-11-16 11:13:03,2024-01-12,40720,3132,13169,3092,13,0.42,0,0,IDR
K | ABO | 16-11-2023 | scale up,Ad group 20231116110818,AWAL BINGUNG.mov_2023-11-16 11:13:03,2024-01-13,29428,1961,15279,1926,15,0.78,0,0,IDR
K | ABO | 16-11-2023 | scale up,Ad group 20231116110818,AWAL BINGUNG.mov_2023-11-16 11:13:03,2024-01-14,48176,2094,13319,3617,23,0.64,2,24088,IDR
K | ABO | 16-11-2023 | scale up,Ad group 20231116110818,AWAL BINGUNG.mov_2023-11-16 11:13:03,2024-01-15,66788,6071,23475,2845,11,0.39,1,66788,IDR
K | ABO | 16-11-2023 | scale up,Ad group 20231116110818,AWAL BINGUNG.mov_2023-11-16 11:13:03,2024-01-16,36205,3620,11585,3125,10,0.32,0,0,IDR
K | ABO | 16-11-2023 | scale up,Ad group 20231116110818,AWAL BINGUNG.mov_2023-11-16 11:13:03,2024-01-17,34851,2489,13629,2557,14,0.55,0,0,IDR
K | ABO | 16-11-2023 | scale up,Ad group 20231116110818,AWAL BINGUNG.mov_2023-11-16 11:13:03,2024-01-18,19155,2736,16891,1134,7,0.62,0,0,IDR
K | ABO | 16-11-2023 | scale up,Ad group 20231116110818,AWAL BINGUNG.mov_2023-11-16 11:13:03,2024-01-19,5448,1816,13033,418,3,0.72,0,0,IDR
K | ABO | 16-11-2023 | scale up,Ad group 20231116110818,AWAL BINGUNG.mov_2023-11-16 11:13:03,2024-01-20,6913,0,40426,171,0,0.0,0,0,IDR
K | ABO | 16-11-2023 | scale up,Ad group 20231116110818,AWAL BINGUNG.mov_2023-11-16 11:13:03,2024-01-21,2610,2610,16312,160,1,0.63,0,0,IDR
K | ABO | 16-11-2023 | scale up,Ad group 20231116110818,AWAL BINGUNG.mov_2023-11-16 11:13:03,2024-01-22,1863,0,11290,165,0,0.0,0,0,IDR
K | ABO | 16-11-2023 | scale up,Ad group 20231116110818,AWAL BINGUNG.mov_2023-11-16 11:13:03,2024-01-23,2175,0,14123,154,0,0.0,0,0,IDR
K | ABO | 16-11-2023 | scale up,Ad group 20231116110818,AWAL BINGUNG.mov_2023-11-16 11:13:03,2024-01-24,3440,0,15357,224,0,0.0,0,0,IDR
K | ABO | 16-11-2023 | scale up,Ad group 20231116110818,AWAL BINGUNG.mov_2023-11-16 11:13:03,2024-01-25,491,491,15838,31,1,3.23,0,0,IDR
K | ABO | 16-11-2023 | scale up,Ad group 20231116110818,AWAL BINGUNG.mov_2023-11-16 11:13:03,2024-01-26,0,0,0,0,0,0.0,0,0,IDR
K | ABO | 22-11-2023 | scale out,Ad group 20231122094131,AWAL BINGUNG.mov_2023-11-22 09:43:26,2023-11-22,4053,4053,7024,577,1,0.17,0,0,IDR
K | ABO | 22-11-2023 | scale out,Ad group 20231122094131,AWAL BINGUNG.mov_2023-11-22 09:43:26,2023-11-23,1603,801,7597,211,2,0.95,0,0,IDR
K | ABO | 22-11-2023 | scale out,Ad group 20231122094131,AWAL BINGUNG.mov_2023-11-22 09:43:26,2023-11-24,899,0,29966,30,0,0.0,0,0,IDR
K | ABO | 22-11-2023 | scale out,Ad group 20231122094131,AWAL BINGUNG.mov_2023-11-22 09:43:26,2023-11-25,202,0,9181,22,0,0.0,0,0,IDR
K | ABO | 22-11-2023 | scale out,Ad group 20231122094131,AWAL BINGUNG.mov_2023-11-22 09:43:26,2023-11-26,72,0,6000,12,0,0.0,0,0,IDR
K | ABO | 22-11-2023 | scale out,Ad group 20231122094131,AWAL BINGUNG.mov_2023-11-22 09:43:26,2023-11-27,49,0,16333,3,0,0.0,0,0,IDR
K | ABO | 16-11-2023 | scale up,Ad group 20231116110818,AWALNYA,2023-11-16,50378,2518,10528,4785,20,0.42,0,0,IDR
K | ABO | 16-11-2023 | scale up,Ad group 20231116110818,AWALNYA,2023-11-17,45492,7582,12196,3730,6,0.16,1,45492,IDR
K | ABO | 16-11-2023 | scale up,Ad group 20231116110818,AWALNYA,2023-11-18,128706,4151,19186,6708,31,0.46,0,0,IDR
K | ABO | 16-11-2023 | scale up,Ad group 20231116110818,AWALNYA,2023-11-19,148615,2518,9851,15085,59,0.39,4,37153,IDR
K | ABO | 16-11-2023 | scale up,Ad group 20231116110818,AWALNYA,2023-11-20,191797,3196,9105,21064,60,0.28,0,0,IDR
K | ABO | 16-11-2023 | scale up,Ad group 20231116110818,AWALNYA,2023-11-21,200064,3704,10852,18434,54,0.29,0,0,IDR
K | ABO | 16-11-2023 | scale up,Ad group 20231116110818,AWALNYA,2023-11-22,52541,8756,14112,3723,6,0.16,0,0,IDR
K | ABO | 16-11-2023 | scale up,Ad group 20231116110818,AWALNYA,2023-11-23,0,0,0,0,0,0.0,0,0,IDR
K | ABO | 16-11-2023 | scale up,Ad group 20231116110818,AWALNYA,2023-11-24,0,0,0,0,0,0.0,0,0,IDR
K | ABO | 16-11-2023 | scale up,Ad group 20231116110818,AWALNYA,2023-11-25,0,0,0,0,0,0.0,0,0,IDR
K | ABO | 16-11-2023 | scale up,Ad group 20231116110818,AWALNYA,2023-11-26,0,0,0,0,0,0.0,0,0,IDR
K | ABO | 16-11-2023 | scale up,Ad group 20231116110818,AWALNYA,2023-11-27,0,0,0,0,0,0.0,0,0,IDR
PS 28 JULI 23,Ad group 20230728015353,Ad name2023-07-28 13:54:28,2023-07-28,73878,5682,73878,1000,13,1.3,0,0,IDR
PS 28 JULI 23,Ad group 20230728015353,Ad name2023-07-28 13:54:28,2023-07-29,421,0,13580,31,0,0.0,0,0,IDR
PS 28 JULI 23,Ad group 20230728015353,Ad name2023-07-28 13:54:28,2023-07-30,0,0,0,0,0,0.0,0,0,IDR
PS 28 JULI 23,Ad group 20230728015353,Ad name2023-07-28 13:54:28,2023-07-31,0,0,0,0,0,0.0,0,0,IDR
PS 28 JULI 23,Ad group 20230728015353,Ad name2023-07-28 13:54:28,2023-08-01,0,0,0,0,0,0.0,0,0,IDR
PS 28 JULI 23,Ad group 20230728015353,Ad name2023-07-28 13:54:28,2023-08-02,0,0,0,0,0,0.0,0,0,IDR
PS 28 JULI 23,Ad group 20230728015353,Ad name2023-07-28 13:54:28,2023-08-03,0,0,0,0,0,0.0,0,0,IDR
PS 28 JULI 23,Ad group 20230728015353,Ad name2023-07-28 13:55:24,2023-07-28,17161,1430,16220,1058,12,1.13,0,0,IDR
PS 28 JULI 23,Ad group 20230728015353,Ad name2023-07-28 13:55:24,2023-07-29,1070,1070,12159,88,1,1.14,0,0,IDR
PS 28 JULI 23,Ad group 20230728015353,Ad name2023-07-28 13:55:24,2023-07-30,0,0,0,0,0,0.0,0,0,IDR
PS 28 JULI 23,Ad group 20230728015353,Ad name2023-07-28 13:55:24,2023-07-31,0,0,0,0,0,0.0,0,0,IDR
PS 28 JULI 23,Ad group 20230728015353,Ad name2023-07-28 13:55:24,2023-08-01,0,0,0,0,0,0.0,0,0,IDR
PS 28 JULI 23,Ad group 20230728015353,Ad name2023-07-28 13:55:24,2023-08-02,0,0,0,0,0,0.0,0,0,IDR
PS 28 JULI 23,Ad group 20230728015353,Ad name2023-07-28 13:55:45,2023-07-28,34393,1375,14217,2419,25,1.03,0,0,IDR
PS 28 JULI 23,Ad group 20230728015353,Ad name2023-07-28 13:55:45,2023-07-29,344,0,8390,41,0,0.0,0,0,IDR
PS 28 JULI 23,Ad group 20230728015353,Ad name2023-07-28 13:55:45,2023-07-30,0,0,0,0,0,0.0,0,0,IDR
PS 28 JULI 23,Ad group 20230728015353,Ad name2023-07-28 13:55:45,2023-07-31,0,0,0,0,0,0.0,0,0,IDR
PS 28 JULI 23,Ad group 20230728015353,Ad name2023-07-28 13:55:45,2023-08-01,0,0,0,0,0,0.0,0,0,IDR
PS 28 JULI 23,Ad group 20230728015353,Ad name2023-07-28 13:55:45,2023-08-02,0,0,0,0,0,0.0,0,0,IDR
 K | ABO | 12-12-2023 | testing,Ad group 20231212092605,Akhir thn banting harga .mov_2023-12-12 09:26:51,2023-12-12,227378,3295,15616,14560,69,0.47,6,37896,IDR
 K | ABO | 12-12-2023 | testing,Ad group 20231212092605,Akhir thn banting harga .mov_2023-12-12 09:26:51,2023-12-13,215190,2502,9194,23404,86,0.37,2,107595,IDR
 K | ABO | 12-12-2023 | testing,Ad group 20231212092605,Akhir thn banting harga .mov_2023-12-12 09:26:51,2023-12-14,407135,6566,19832,20529,62,0.3,3,135711,IDR
 K | ABO | 12-12-2023 | testing,Ad group 20231212092605,Akhir thn banting harga .mov_2023-12-12 09:26:51,2023-12-15,319623,4501,21037,15193,71,0.47,2,159811,IDR
 K | ABO | 12-12-2023 | testing,Ad group 20231212092605,Akhir thn banting harga .mov_2023-12-12 09:26:51,2023-12-16,393584,5622,18942,20778,70,0.34,2,196792,IDR
 K | ABO | 12-12-2023 | testing,Ad group 20231212092605,Akhir thn banting harga .mov_2023-12-12 09:26:51,2023-12-17,369206,5274,19350,19080,70,0.37,3,123068,IDR
 K | ABO | 12-12-2023 | testing,Ad group 20231212092605,Akhir thn banting harga .mov_2023-12-12 09:26:51,2023-12-18,416266,6121,21123,19706,68,0.35,7,59466,IDR
 K | ABO | 12-12-2023 | testing,Ad group 20231212092605,Akhir thn banting harga .mov_2023-12-12 09:26:51,2023-12-19,290686,4688,19014,15288,62,0.41,3,96895,IDR
 K | ABO | 12-12-2023 | testing,Ad group 20231212092605,Akhir thn banting harga .mov_2023-12-12 09:26:51,2023-12-20,283688,5157,25014,11341,55,0.48,3,94562,IDR
 K | ABO | 12-12-2023 | testing,Ad group 20231212092605,Akhir thn banting harga .mov_2023-12-12 09:26:51,2023-12-21,272246,7358,26909,10117,37,0.37,3,90748,IDR
 K | ABO | 12-12-2023 | testing,Ad group 20231212092605,Akhir thn banting harga .mov_2023-12-12 09:26:51,2023-12-22,64243,5840,23758,2704,11,0.41,0,0,IDR
 K | ABO | 12-12-2023 | testing,Ad group 20231212092605,Akhir thn banting harga .mov_2023-12-12 09:26:51,2023-12-23,0,0,0,0,0,0.0,0,0,IDR
 K | ABO | 12-12-2023 | testing,Ad group 20231212092605,Akhir thn banting harga .mov_2023-12-12 09:26:51,2023-12-24,0,0,0,0,0,0.0,0,0,IDR
 K | ABO | 12-12-2023 | testing,Ad group 20231212092605,Akhir thn banting harga .mov_2023-12-12 09:26:51,2023-12-25,0,0,0,0,0,0.0,0,0,IDR
 K | ABO | 12-12-2023 | testing,Ad group 20231212092605,Akhir thn banting harga .mov_2023-12-12 09:26:51,2023-12-26,0,0,0,0,0,0.0,0,0,IDR
 K | ABO | 12-12-2023 | testing,Ad group 20231212092605,Akhir thn banting harga .mov_2023-12-12 09:26:51,2023-12-27,0,0,0,0,0,0.0,0,0,IDR
 K | ABO | 12-12-2023 | testing,Ad group 20231212092605,Akhir thn banting harga .mov_2023-12-12 09:26:51,2024-01-02,0,0,0,0,0,0.0,0,0,IDR
 K | ABO | 12-12-2023 | testing,Ad group 20231212092605,Akhir thn banting harga .mov_2023-12-12 09:26:51,2024-01-06,0,0,0,0,0,0.0,0,0,IDR
 K | ABO | 12-12-2023 | testing,Ad group 20231212092605,Akhir thn banting harga .mov_2023-12-12 09:26:51,2024-01-09,0,0,0,0,0,0.0,0,0,IDR
 K | ABO | 12-12-2023 | testing,Ad group 20231212092605,Akhir thn banting harga .mov_2023-12-12 09:26:51,2024-01-17,0,0,0,0,0,0.0,0,0,IDR
K | ABO | 21-02-2024 | scale out,ID/18-44/games (by type)/Balanced,Akhir thn banting harga .mov_2024-02-21 10:14:24,2024-02-21,138468,3956,10070,13750,35,0.25,0,0,IDR
K | ABO | 21-02-2024 | scale out,ID/18-44/games (by type)/Balanced,Akhir thn banting harga .mov_2024-02-21 10:14:24,2024-02-22,151634,4738,17885,8478,32,0.38,1,151634,IDR
K | ABO | 21-02-2024 | scale out,ID/18-44/games (by type)/Balanced,Akhir thn banting harga .mov_2024-02-21 10:14:24,2024-02-23,26245,3749,10268,2556,7,0.27,0,0,IDR
K | ABO | 21-02-2024 | scale out,ID/18-44/games (by type)/Balanced,Akhir thn banting harga .mov_2024-02-21 10:14:24,2024-02-24,0,0,0,0,0,0.0,0,0,IDR
K | ABO | 21-02-2024 | scale out,ID/18-44/games (by type)/Balanced,Akhir thn banting harga .mov_2024-02-21 10:14:24,2024-02-25,0,0,0,0,0,0.0,0,0,IDR
K | ABO | 21-02-2024 | scale out,ID/18-44/games (by type)/Balanced,Akhir thn banting harga .mov_2024-02-21 10:14:24,2024-02-26,0,0,0,0,0,0.0,0,0,IDR
K | ABO | 21-02-2024 | scale out,ID/18-44/games (by type)/Balanced,Akhir thn banting harga .mov_2024-02-21 10:14:24,2024-02-27,0,0,0,0,0,0.0,0,0,IDR
#ISU ZYMUNO,K | ABO | 01-03-2024 | testing,Alfa 1(1).mp4_2024-03-01 13:52:25,2024-03-01,3942,1971,14764,267,2,0.75,0,0,IDR
#ISU ZYMUNO,K | ABO | 01-03-2024 | testing,Alfa 1(1).mp4_2024-03-01 13:52:25,2024-03-02,3,0,3000,1,0,0.0,0,0,IDR
#ISU ZYMUNO,K | ABO | 01-03-2024 | testing,Alfa 1(1).mp4_2024-03-01 13:52:25,2024-03-03,0,0,0,0,0,0.0,0,0,IDR
#ISU ZYMUNO,K | ABO | 01-03-2024 | testing,Alfa 1(1).mp4_2024-03-01 13:52:25,2024-03-05,0,0,0,0,0,0.0,0,0,IDR
#ISU ZYMUNO,K | ABO | 01-03-2024 | testing,Alfa 1(1).mp4_2024-03-01 13:52:25,2024-03-06,0,0,0,0,0,0.0,0,0,IDR
Konversi 20 Sept 23,Ad group 20230920094534,Amel 10.mov_2023-09-20 09:50:22,2023-09-20,71330,334,6114,11665,213,1.83,1,71330,IDR
Konversi 20 Sept 23,Ad group 20230920094534,Amel 10.mov_2023-09-20 09:50:22,2023-09-21,61326,218,5009,12241,281,2.3,0,0,IDR
Konversi 20 Sept 23,Ad group 20230920094534,Amel 10.mov_2023-09-20 09:50:22,2023-09-22,0,0,0,0,0,0.0,0,0,IDR
Konversi 20 Sept 23,Ad group 20230920094534,Amel 10.mov_2023-09-20 09:50:22,2023-09-23,0,0,0,0,0,0.0,0,0,IDR
Konversi 20 Sept 23,Ad group 20230920094534,Amel 10.mov_2023-09-20 09:50:22,2023-09-24,0,0,0,0,0,0.0,0,0,IDR
Konversi 20 Sept 23,Ad group 20230920094534,Amel 10.mov_2023-09-20 09:50:22,2023-09-25,0,0,0,0,0,0.0,0,0,IDR
Konversi 20 Sept 23,Ad group 20230920094534,Amel 10.mov_2023-09-20 09:50:22,2023-09-26,0,0,0,0,0,0.0,0,0,IDR
Konversi 20 Sept 23,Ad group 20230920094534,Amel 10.mov_2023-09-20 09:50:22,2023-09-29,0,0,0,0,0,0.0,0,0,IDR
Konversi 21 Sept 23,Ad group 20230920032321,Amel 15.mov_2023-09-20 15:27:42,2023-09-20,2345,781,7020,334,3,0.9,0,0,IDR
Konversi 21 Sept 23,Ad group 20230920032321,Amel 15.mov_2023-09-20 15:27:42,2023-09-21,80241,3086,14499,5534,26,0.47,0,0,IDR
Konversi 21 Sept 23,Ad group 20230920032321,Amel 15.mov_2023-09-20 15:27:42,2023-09-22,56,0,9333,6,0,0.0,0,0,IDR
Konversi 21 Sept 23,Ad group 20230920032321,Amel 15.mov_2023-09-20 15:27:42,2023-09-23,0,0,0,0,0,0.0,0,0,IDR
Konversi 21 Sept 23,Ad group 20230920032321,Amel 15.mov_2023-09-20 15:27:42,2023-09-24,0,0,0,0,0,0.0,0,0,IDR
Konversi 21 Sept 23,Ad group 20230920032321,Amel 15.mov_2023-09-20 15:27:42,2023-09-25,0,0,0,0,0,0.0,0,0,IDR
Konversi 21 Sept 23,Ad group 20230920032321,Amel 15.mov_2023-09-20 15:27:42,2023-09-26,0,0,0,0,0,0.0,0,0,IDR
Konversi 21 Sept 23,Ad group 20230920032321,Amel 16.mov_2023-09-20 15:27:42,2023-09-20,1289,0,8651,149,0,0.0,0,0,IDR
Konversi 21 Sept 23,Ad group 20230920032321,Amel 16.mov_2023-09-20 15:27:42,2023-09-21,158938,2037,13188,12051,78,0.65,0,0,IDR
Konversi 21 Sept 23,Ad group 20230920032321,Amel 16.mov_2023-09-20 15:27:42,2023-09-22,180,0,12857,14,0,0.0,0,0,IDR
Konversi 21 Sept 23,Ad group 20230920032321,Amel 16.mov_2023-09-20 15:27:42,2023-09-23,0,0,0,0,0,0.0,0,0,IDR
Konversi 21 Sept 23,Ad group 20230920032321,Amel 16.mov_2023-09-20 15:27:42,2023-09-24,0,0,0,0,0,0.0,0,0,IDR
Konversi 21 Sept 23,Ad group 20230920032321,Amel 16.mov_2023-09-20 15:27:42,2023-09-25,0,0,0,0,0,0.0,0,0,IDR
Konversi 21 Sept 23,Ad group 20230920032321,Amel 16.mov_2023-09-20 15:27:42,2023-09-26,0,0,0,0,0,0.0,0,0,IDR
Konversi 22 Spet 23,Ad px2,Amel 17.mov_2023-09-22 13:30:22,2023-09-22,27449,2495,10909,2516,11,0.44,0,0,IDR
Konversi 22 Spet 23,Ad px2,Amel 17.mov_2023-09-22 13:30:22,2023-09-23,60160,4010,12893,4666,15,0.32,0,0,IDR
Konversi 22 Spet 23,Ad px2,Amel 17.mov_2023-09-22 13:30:22,2023-09-24,167,0,6958,24,0,0.0,0,0,IDR
Konversi 22 Spet 23,Ad px2,Amel 17.mov_2023-09-22 13:30:22,2023-09-25,0,0,0,0,0,0.0,0,0,IDR
Konversi 22 Spet 23,Ad px2,Amel 17.mov_2023-09-22 13:30:22,2023-09-26,0,0,0,0,0,0.0,0,0,IDR
Konversi 22 Spet 23,Ad px2,Amel 17.mov_2023-09-22 13:30:22,2023-09-27,0,0,0,0,0,0.0,0,0,IDR
Konversi 22 Spet 23,Ad px2,Amel 17.mov_2023-09-22 13:30:22,2023-09-28,0,0,0,0,0,0.0,0,0,IDR
Konversi 22 Spet 23,Ad px2,Amel 17.mov_2023-09-22 13:30:22,2023-10-01,609,609,3239,188,1,0.53,0,0,IDR
Konversi 16 Sept 23,Ad group 20230915023848,Amel 3.mov_2023-09-15 14:39:44,2023-09-15,4743,1581,9562,496,3,0.6,0,0,IDR
Konversi 16 Sept 23,Ad group 20230915023848,Amel 3.mov_2023-09-15 14:39:44,2023-09-16,20309,752,6613,3071,27,0.88,0,0,IDR
Konversi 16 Sept 23,Ad group 20230915023848,Amel 3.mov_2023-09-15 14:39:44,2023-09-17,0,0,0,0,0,0.0,0,0,IDR
Konversi 16 Sept 23,Ad group 20230915023848,Amel 3.mov_2023-09-15 14:39:44,2023-09-18,0,0,0,0,0,0.0,0,0,IDR
Konversi 16 Sept 23,Ad group 20230915023848,Amel 3.mov_2023-09-15 14:39:44,2023-09-19,0,0,0,0,0,0.0,0,0,IDR
Konversi 16 Sept 23,Ad group 20230915023848,Amel 3.mov_2023-09-15 14:39:44,2023-09-20,0,0,0,0,0,0.0,0,0,IDR
Konversi 16 Sept 23,Ad group 20230915023848,Amel 3.mov_2023-09-15 14:39:44,2023-09-21,0,0,0,0,0,0.0,0,0,IDR
Konversi 16 sept 23,Ad group 20230915084216,Amel 4.mov_002,2023-09-16,101315,3070,16396,6179,33,0.53,1,101315,IDR
Konversi 16 sept 23,Ad group 20230915084216,Amel 4.mov_002,2023-09-17,64337,4595,23018,2795,14,0.5,1,64337,IDR
Konversi 16 sept 23,Ad group 20230915084216,Amel 4.mov_002,2023-09-18,32862,2987,28978,1134,11,0.97,1,32862,IDR
Konversi 16 sept 23,Ad group 20230915084216,Amel 4.mov_002,2023-09-19,41340,3180,24274,1703,13,0.76,1,41340,IDR
Konversi 16 sept 23,Ad group 20230915084216,Amel 4.mov_002,2023-09-20,156258,3396,29678,5265,46,0.87,2,78129,IDR
Konversi 16 sept 23,Ad group 20230915084216,Amel 4.mov_002,2023-09-21,94895,6326,40920,2319,15,0.65,0,0,IDR
Konversi 16 sept 23,Ad group 20230915084216,Amel 4.mov_002,2023-09-22,730,0,91250,8,0,0.0,0,0,IDR
Konversi 16 sept 23,Ad group 20230915084216,Amel 4.mov_002,2023-09-23,0,0,0,0,0,0.0,0,0,IDR
Konversi 16 sept 23,Ad group 20230915084216,Amel 4.mov_002,2023-09-24,0,0,0,0,0,0.0,0,0,IDR
Konversi 16 sept 23,Ad group 20230915084216,Amel 4.mov_002,2023-09-25,0,0,0,0,0,0.0,0,0,IDR
Konversi 16 sept 23,Ad group 20230915084216,Amel 4.mov_002,2023-09-26,0,0,0,0,0,0.0,0,0,IDR
Konversi 15 Sept 23 ,Ad group 20230914013907,Amel 4.mov_2023-09-14 13:39:45,2023-09-15,21532,3076,15184,1418,7,0.49,0,0,IDR
Konversi 15 Sept 23 ,Ad group 20230914013907,Amel 4.mov_2023-09-14 13:39:45,2023-09-16,5833,1166,6333,921,5,0.54,0,0,IDR
Konversi 15 Sept 23 ,Ad group 20230914013907,Amel 4.mov_2023-09-14 13:39:45,2023-09-17,2828,1414,4901,577,2,0.35,0,0,IDR
Konversi 15 Sept 23 ,Ad group 20230914013907,Amel 4.mov_2023-09-14 13:39:45,2023-09-18,6145,877,6145,1000,7,0.7,0,0,IDR
Konversi 15 Sept 23 ,Ad group 20230914013907,Amel 4.mov_2023-09-14 13:39:45,2023-09-19,1271,0,6983,182,0,0.0,0,0,IDR
Konversi 15 Sept 23 ,Ad group 20230914013907,Amel 4.mov_2023-09-14 13:39:45,2023-09-20,0,0,0,0,0,0.0,0,0,IDR
Konversi 15 Sept 23 ,Ad group 20230914013907,Amel 4.mov_2023-09-14 13:39:45,2023-09-21,0,0,0,0,0,0.0,0,0,IDR
Konversi 22 Sept 23,ad px2,Amel 4.mov_2023-09-21 23:19:05,2023-09-22,3319,1659,15655,212,2,0.94,0,0,IDR
Konversi 16 sept 23,Ad group 20230915084216,Amel 6.mov_002,2023-09-16,41660,4166,13284,3136,10,0.32,0,0,IDR
Konversi 16 sept 23,Ad group 20230915084216,Amel 6.mov_002,2023-09-17,27839,4639,16600,1677,6,0.36,0,0,IDR
Konversi 16 sept 23,Ad group 20230915084216,Amel 6.mov_002,2023-09-18,17523,17523,28081,624,1,0.16,0,0,IDR
Konversi 16 sept 23,Ad group 20230915084216,Amel 6.mov_002,2023-09-19,18118,4529,20243,895,4,0.45,0,0,IDR
Konversi 16 sept 23,Ad group 20230915084216,Amel 6.mov_002,2023-09-20,58301,3068,21131,2759,19,0.69,0,0,IDR
Konversi 16 sept 23,Ad group 20230915084216,Amel 6.mov_002,2023-09-21,117758,4205,24492,4808,28,0.58,2,58879,IDR
Konversi 16 sept 23,Ad group 20230915084216,Amel 6.mov_002,2023-09-22,25,0,5000,5,0,0.0,0,0,IDR
Konversi 16 sept 23,Ad group 20230915084216,Amel 6.mov_002,2023-09-23,0,0,0,0,0,0.0,0,0,IDR
Konversi 16 sept 23,Ad group 20230915084216,Amel 6.mov_002,2023-09-24,0,0,0,0,0,0.0,0,0,IDR
Konversi 16 sept 23,Ad group 20230915084216,Amel 6.mov_002,2023-09-25,0,0,0,0,0,0.0,0,0,IDR
Konversi 16 sept 23,Ad group 20230915084216,Amel 6.mov_002,2023-09-26,0,0,0,0,0,0.0,0,0,IDR
Konversi 15 Sept 23 ,Ad group 20230914013907,Amel 7.mov_2023-09-14 13:39:45,2023-09-15,16768,2096,9034,1856,8,0.43,0,0,IDR
Konversi 15 Sept 23 ,Ad group 20230914013907,Amel 7.mov_2023-09-14 13:39:45,2023-09-16,21488,370,4093,5249,58,1.1,0,0,IDR
Konversi 15 Sept 23 ,Ad group 20230914013907,Amel 7.mov_2023-09-14 13:39:45,2023-09-17,8471,770,6037,1403,11,0.78,0,0,IDR
Konversi 15 Sept 23 ,Ad group 20230914013907,Amel 7.mov_2023-09-14 13:39:45,2023-09-18,9916,495,5987,1656,20,1.21,0,0,IDR
Konversi 15 Sept 23 ,Ad group 20230914013907,Amel 7.mov_2023-09-14 13:39:45,2023-09-19,2057,1028,11118,185,2,1.08,0,0,IDR
Konversi 15 Sept 23 ,Ad group 20230914013907,Amel 7.mov_2023-09-14 13:39:45,2023-09-20,0,0,0,0,0,0.0,0,0,IDR
Konversi 15 Sept 23 ,Ad group 20230914013907,Amel 7.mov_2023-09-14 13:39:45,2023-09-21,0,0,0,0,0,0.0,0,0,IDR
Konversi 15 Sept 23 ,Ad group 20230914013907,Amel 7.mov_2023-09-14 13:39:45,2023-09-22,0,0,0,0,0,0.0,0,0,IDR
Konversi 15 Sept 23 ,Ad group 20230914013907,Amel 7.mov_2023-09-14 13:39:45,2023-09-23,0,0,0,0,0,0.0,0,0,IDR
Konversi 15 Sept 23 ,Ad group 20230914013907,Amel 7.mov_2023-09-14 13:39:45,2023-10-10,0,0,0,0,0,0.0,0,0,IDR
Konversi 15 Sept 23 ,Ad group 20230914013907,Amel 7.mov_2023-09-14 13:39:45,2023-10-12,0,0,0,0,0,0.0,0,0,IDR
Konversi 20 Sept 23,Ad group 20230920094534,Amel 9.mov_2023-09-20 09:50:22,2023-09-20,17206,1323,8442,2038,13,0.64,0,0,IDR
Konversi 20 Sept 23,Ad group 20230920094534,Amel 9.mov_2023-09-20 09:50:22,2023-09-21,0,0,0,0,0,0.0,0,0,IDR
Konversi 20 Sept 23,Ad group 20230920094534,Amel 9.mov_2023-09-20 09:50:22,2023-09-23,0,0,0,0,0,0.0,0,0,IDR
Konversi 20 Sept 23,Ad group 20230920094534,Amel 9.mov_2023-09-20 09:50:22,2023-09-24,0,0,0,0,0,0.0,0,0,IDR
Konversi 20 Sept 23,Ad group 20230920094534,Amel 9.mov_2023-09-20 09:50:22,2023-09-25,0,0,0,0,0,0.0,0,0,IDR
Konversi 22 Spet 23,Ad px2,Amel 9.mov_2023-09-22 13:30:22,2023-09-22,28255,1046,9387,3010,27,0.9,0,0,IDR
Konversi 22 Spet 23,Ad px2,Amel 9.mov_2023-09-22 13:30:22,2023-09-23,114580,2121,11695,9797,54,0.55,1,114580,IDR
Konversi 22 Spet 23,Ad px2,Amel 9.mov_2023-09-22 13:30:22,2023-09-24,599,0,19966,30,0,0.0,0,0,IDR
Konversi 22 Spet 23,Ad px2,Amel 9.mov_2023-09-22 13:30:22,2023-09-25,6,0,6000,1,0,0.0,0,0,IDR
Konversi 22 Spet 23,Ad px2,Amel 9.mov_2023-09-22 13:30:22,2023-09-26,0,0,0,0,0,0.0,0,0,IDR
Konversi 22 Spet 23,Ad px2,Amel 9.mov_2023-09-22 13:30:22,2023-09-27,0,0,0,0,0,0.0,0,0,IDR
Konversi 22 Spet 23,Ad px2,Amel 9.mov_2023-09-22 13:30:22,2023-09-28,0,0,0,0,0,0.0,0,0,IDR
Konversi 22 Spet 23,Ad px2,Amel 9.mov_2023-09-22 13:30:22,2023-10-01,1134,1134,7767,146,1,0.68,0,0,IDR
Konversi 22 Spet 23,Ad px2,Amel 9.mov_2023-09-22 13:30:22,2023-10-02,0,0,0,0,0,0.0,0,0,IDR
Konversi 22 Spet 23,Ad px2,Amel 9.mov_2023-09-22 13:30:22,2023-10-04,0,0,0,0,0,0.0,0,0,IDR
Konversi 30 Sept 23,Ad group5,Amel 9.mov_2023-09-29 12:22:15,2023-09-29,22744,3249,14022,1622,7,0.43,0,0,IDR
Konversi 30 Sept 23,Ad group5,Amel 9.mov_2023-09-29 12:22:15,2023-09-30,128128,1642,9959,12865,78,0.61,4,32032,IDR
Konversi 30 Sept 23,Ad group5,Amel 9.mov_2023-09-29 12:22:15,2023-10-01,130211,1252,8835,14737,104,0.71,1,130211,IDR
Konversi 30 Sept 23,Ad group5,Amel 9.mov_2023-09-29 12:22:15,2023-10-02,201705,1179,9432,21385,171,0.8,1,201705,IDR
Konversi 30 Sept 23,Ad group5,Amel 9.mov_2023-09-29 12:22:15,2023-10-03,192312,1479,11521,16691,130,0.78,1,192312,IDR
Konversi 30 Sept 23,Ad group5,Amel 9.mov_2023-09-29 12:22:15,2023-10-04,223830,1308,13856,16154,171,1.06,9,24870,IDR
Konversi 30 Sept 23,Ad group5,Amel 9.mov_2023-09-29 12:22:15,2023-10-05,357594,1007,8868,40323,355,0.88,14,25542,IDR
Konversi 30 Sept 23,Ad group5,Amel 9.mov_2023-09-29 12:22:15,2023-10-06,271695,1029,7287,37280,264,0.71,6,45282,IDR
Konversi 30 Sept 23,Ad group5,Amel 9.mov_2023-09-29 12:22:15,2023-10-07,303875,1344,7897,38479,226,0.59,3,101291,IDR
Konversi 30 Sept 23,Ad group5,Amel 9.mov_2023-09-29 12:22:15,2023-10-08,331531,1473,8374,39589,225,0.57,7,47361,IDR
Konversi 30 Sept 23,Ad group5,Amel 9.mov_2023-09-29 12:22:15,2023-10-09,229327,1164,6213,36908,197,0.53,1,229327,IDR
Konversi 30 Sept 23,Ad group5,Amel 9.mov_2023-09-29 12:22:15,2023-10-10,347135,1961,11178,31053,177,0.57,9,38570,IDR
Konversi 30 Sept 23,Ad group5,Amel 9.mov_2023-09-29 12:22:15,2023-10-11,231635,1768,10879,21290,131,0.62,3,77211,IDR
Konversi 30 Sept 23,Ad group5,Amel 9.mov_2023-09-29 12:22:15,2023-10-12,247331,1682,8981,27539,147,0.53,3,82443,IDR
Konversi 30 Sept 23,Ad group5,Amel 9.mov_2023-09-29 12:22:15,2023-10-13,268968,2204,9271,29010,122,0.42,3,89656,IDR
Konversi 30 Sept 23,Ad group5,Amel 9.mov_2023-09-29 12:22:15,2023-10-14,293857,2012,8456,34750,146,0.42,5,58771,IDR
Konversi 30 Sept 23,Ad group5,Amel 9.mov_2023-09-29 12:22:15,2023-10-15,229376,1911,8162,28100,120,0.43,2,114688,IDR
Konversi 30 Sept 23,Ad group5,Amel 9.mov_2023-09-29 12:22:15,2023-10-16,359021,1759,7749,46326,204,0.44,8,44877,IDR
Konversi 30 Sept 23,Ad group5,Amel 9.mov_2023-09-29 12:22:15,2023-10-17,331163,1959,8740,37890,169,0.45,10,33116,IDR
Konversi 30 Sept 23,Ad group5,Amel 9.mov_2023-09-29 12:22:15,2023-10-18,237288,2238,8082,29360,106,0.36,3,79096,IDR
Konversi 30 Sept 23,Ad group5,Amel 9.mov_2023-09-29 12:22:15,2023-10-19,296168,2794,9716,30482,106,0.35,4,74042,IDR
Konversi 30 Sept 23,Ad group5,Amel 9.mov_2023-09-29 12:22:15,2023-10-20,297487,2361,10393,28623,126,0.44,1,297487,IDR
Konversi 30 Sept 23,Ad group5,Amel 9.mov_2023-09-29 12:22:15,2023-10-21,327515,2408,12040,27200,136,0.5,3,109171,IDR
Konversi 30 Sept 23,Ad group5,Amel 9.mov_2023-09-29 12:22:15,2023-10-22,294303,2132,11694,25165,138,0.55,3,98101,IDR
Konversi 30 Sept 23,Ad group5,Amel 9.mov_2023-09-29 12:22:15,2023-10-23,200054,2778,11849,16883,72,0.43,2,100027,IDR
Konversi 30 Sept 23,Ad group5,Amel 9.mov_2023-09-29 12:22:15,2023-10-24,217292,2049,9547,22759,106,0.47,2,108646,IDR
Konversi 30 Sept 23,Ad group5,Amel 9.mov_2023-09-29 12:22:15,2023-10-25,175766,2043,8947,19645,86,0.44,2,87883,IDR
Konversi 30 Sept 23,Ad group5,Amel 9.mov_2023-09-29 12:22:15,2023-10-26,200165,2987,11042,18126,67,0.37,3,66721,IDR
Konversi 30 Sept 23,Ad group5,Amel 9.mov_2023-09-29 12:22:15,2023-10-27,111901,1929,9924,11275,58,0.51,1,111901,IDR
Konversi 30 Sept 23,Ad group5,Amel 9.mov_2023-09-29 12:22:15,2023-10-28,0,0,0,0,0,0.0,0,0,IDR
Konversi 30 Sept 23,Ad group5,Amel 9.mov_2023-09-29 12:22:15,2023-10-29,102,0,10200,10,0,0.0,0,0,IDR
Konversi 30 Sept 23,Ad group5,Amel 9.mov_2023-09-29 12:22:15,2023-10-30,30,0,6000,5,0,0.0,0,0,IDR
Konversi 30 Sept 23,Ad group5,Amel 9.mov_2023-09-29 12:22:15,2023-10-31,0,0,0,0,0,0.0,0,0,IDR
Konversi 30 Sept 23,Ad group5,Amel 9.mov_2023-09-29 12:22:15,2023-11-01,0,0,0,0,0,0.0,0,0,IDR
Konversi 30 Sept 23,Ad group5,Amel 9.mov_2023-09-29 12:22:15,2023-11-02,0,0,0,0,0,0.0,0,0,IDR
Konversi 30 Sept 23,Ad group5,Amel 9.mov_2023-09-29 12:22:15,2023-11-12,0,0,0,0,0,0.0,0,0,IDR
Konversi 30 Sept 23,Ad group5,Amel 9.mov_2023-09-29 12:22:15,2023-11-16,0,0,0,0,0,0.0,0,0,IDR
Konversi 30 Sept 23,Ad group5,Amel 9.mov_2023-09-29 12:22:15,2023-11-21,0,0,0,0,0,0.0,0,0,IDR
Konversi 30 Sept 23,Ad group5,Amel 9.mov_2023-09-29 12:22:15,2023-11-28,0,0,0,0,0,0.0,0,0,IDR
K | ABO | 29-11-2023 | testing,Ad group 20231129024017,Artis konsumsi .mov_2023-11-29 14:42:23,2023-11-29,101862,1616,5314,19167,63,0.33,1,101862,IDR
K | ABO | 29-11-2023 | testing,Ad group 20231129024017,Artis konsumsi .mov_2023-11-29 14:42:23,2023-11-30,46707,1729,6083,7678,27,0.35,0,0,IDR
K | ABO | 29-11-2023 | testing,Ad group 20231129024017,Artis konsumsi .mov_2023-11-29 14:42:23,2023-12-01,8072,1345,5566,1450,6,0.41,0,0,IDR
K | ABO | 29-11-2023 | testing,Ad group 20231129024017,Artis konsumsi .mov_2023-11-29 14:42:23,2023-12-02,9683,1936,7291,1328,5,0.38,0,0,IDR
K | ABO | 29-11-2023 | testing,Ad group 20231129024017,Artis konsumsi .mov_2023-11-29 14:42:23,2023-12-03,0,0,0,0,0,0.0,0,0,IDR
K | ABO | 29-11-2023 | testing,Ad group 20231129024017,Artis konsumsi .mov_2023-11-29 14:42:23,2023-12-04,0,0,0,0,0,0.0,0,0,IDR
K | ABO | 29-11-2023 | testing,Ad group 20231129024017,Artis konsumsi .mov_2023-11-29 14:42:23,2023-12-05,0,0,0,0,0,0.0,0,0,IDR
K | ABO | 29-11-2023 | testing,Ad group 20231129024017,Artis konsumsi .mov_2023-11-29 14:42:23,2023-12-06,0,0,0,0,0,0.0,0,0,IDR
K | ABO | 04-12-2023 | testing,Ad group 20231204023000,Atasi bendjolan .mov_2023-12-04 14:30:42,2023-12-04,67012,3046,10908,6143,22,0.36,0,0,IDR
K | ABO | 04-12-2023 | testing,Ad group 20231204023000,Atasi bendjolan .mov_2023-12-04 14:30:42,2023-12-05,54585,3639,8432,6473,15,0.23,1,54585,IDR
K | ABO | 04-12-2023 | testing,Ad group 20231204023000,Atasi bendjolan .mov_2023-12-04 14:30:42,2023-12-06,32656,2177,8517,3834,15,0.39,0,0,IDR
K | ABO | 04-12-2023 | testing,Ad group 20231204023000,Atasi bendjolan .mov_2023-12-04 14:30:42,2023-12-07,40888,4088,11596,3526,10,0.28,0,0,IDR
K | ABO | 04-12-2023 | testing,Ad group 20231204023000,Atasi bendjolan .mov_2023-12-04 14:30:42,2023-12-08,50485,4589,12144,4157,11,0.26,0,0,IDR
K | ABO | 04-12-2023 | testing,Ad group 20231204023000,Atasi bendjolan .mov_2023-12-04 14:30:42,2023-12-09,6224,6224,11336,549,1,0.18,0,0,IDR
K | ABO | 04-12-2023 | testing,Ad group 20231204023000,Atasi bendjolan .mov_2023-12-04 14:30:42,2023-12-10,0,0,0,0,0,0.0,0,0,IDR
K | ABO | 04-12-2023 | testing,Ad group 20231204023000,Atasi bendjolan .mov_2023-12-04 14:30:42,2023-12-11,0,0,0,0,0,0.0,0,0,IDR
K | ABO | 04-12-2023 | testing,Ad group 20231204023000,Atasi bendjolan .mov_2023-12-04 14:30:42,2023-12-12,0,0,0,0,0,0.0,0,0,IDR
K | ABO | 04-12-2023 | testing,Ad group 20231204023000,Atasi bendjolan .mov_2023-12-04 14:30:42,2023-12-13,0,0,0,0,0,0.0,0,0,IDR
K | ABO | 04-12-2023 | testing,Ad group 20231204023000,Atasi bendjolan .mov_2023-12-04 14:30:42,2024-02-17,0,0,0,0,0,0.0,0,0,IDR
 K | ABO | 04-12-2023 | testing,Ad group 20231204091809,Atasi benjolan.mov_2023-12-04 09:18:39,2023-12-04,46391,3313,8546,5428,14,0.26,0,0,IDR
 K | ABO | 04-12-2023 | testing,Ad group 20231204091809,Atasi benjolan.mov_2023-12-04 09:18:39,2023-12-05,101070,4211,9135,11063,24,0.22,0,0,IDR
 K | ABO | 04-12-2023 | testing,Ad group 20231204091809,Atasi benjolan.mov_2023-12-04 09:18:39,2023-12-06,23514,3359,8721,2696,7,0.26,0,0,IDR
 K | ABO | 04-12-2023 | testing,Ad group 20231204091809,Atasi benjolan.mov_2023-12-04 09:18:39,2023-12-07,0,0,0,0,0,0.0,0,0,IDR
 K | ABO | 04-12-2023 | testing,Ad group 20231204091809,Atasi benjolan.mov_2023-12-04 09:18:39,2023-12-08,0,0,0,0,0,0.0,0,0,IDR
 K | ABO | 04-12-2023 | testing,Ad group 20231204091809,Atasi benjolan.mov_2023-12-04 09:18:39,2023-12-09,0,0,0,0,0,0.0,0,0,IDR
 K | ABO | 04-12-2023 | testing,Ad group 20231204091809,Atasi benjolan.mov_2023-12-04 09:18:39,2023-12-10,0,0,0,0,0,0.0,0,0,IDR
 K | ABO | 04-12-2023 | testing,Ad group 20231204091809,Atasi benjolan.mov_2023-12-04 09:18:39,2023-12-11,0,0,0,0,0,0.0,0,0,IDR
K | ABO | 24-11-2023 | scale out,Ad group 20231124090215,BARU KETAHUAN .mov_2023-11-24 09:02:36,2023-11-24,32058,1457,5884,5448,22,0.4,0,0,IDR
K | ABO | 24-11-2023 | scale out,Ad group 20231124090215,BARU KETAHUAN .mov_2023-11-24 09:02:36,2023-11-25,98903,1336,4553,21718,74,0.34,2,49451,IDR
K | ABO | 24-11-2023 | scale out,Ad group 20231124090215,BARU KETAHUAN .mov_2023-11-24 09:02:36,2023-11-26,132231,918,3368,39261,144,0.37,1,132231,IDR
K | ABO | 24-11-2023 | scale out,Ad group 20231124090215,BARU KETAHUAN .mov_2023-11-24 09:02:36,2023-11-27,170100,900,3000,56696,189,0.33,1,170100,IDR
K | ABO | 24-11-2023 | scale out,Ad group 20231124090215,BARU KETAHUAN .mov_2023-11-24 09:02:36,2023-11-28,248565,433,2397,103665,573,0.55,2,124282,IDR
K | ABO | 24-11-2023 | scale out,Ad group 20231124090215,BARU KETAHUAN .mov_2023-11-24 09:02:36,2023-11-29,41031,562,2316,17715,73,0.41,0,0,IDR
K | ABO | 24-11-2023 | scale out,Ad group 20231124090215,BARU KETAHUAN .mov_2023-11-24 09:02:36,2023-11-30,0,0,0,0,0,0.0,0,0,IDR
K | ABO | 24-11-2023 | scale out,Ad group 20231124090215,BARU KETAHUAN .mov_2023-11-24 09:02:36,2023-12-01,0,0,0,0,0,0.0,0,0,IDR
K | ABO | 24-11-2023 | scale out,Ad group 20231124090215,BARU KETAHUAN .mov_2023-11-24 09:02:36,2023-12-02,0,0,0,0,0,0.0,0,0,IDR
K | ABO | 24-11-2023 | scale out,Ad group 20231124090215,BARU KETAHUAN .mov_2023-11-24 09:02:36,2023-12-03,0,0,0,0,0,0.0,0,0,IDR
K | ABO | 24-11-2023 | scale out,Ad group 20231124090215,BARU KETAHUAN .mov_2023-11-24 09:02:36,2023-12-05,0,0,0,0,0,0.0,0,0,IDR
K | ABO | 24-11-2023 | scale out,Ad group 20231124090215,BARU KETAHUAN .mov_2023-11-24 09:02:36,2023-12-12,0,0,0,0,0,0.0,0,0,IDR
K | ABO | 18-11-2023 | scale out,Ad group 20231118101735,BARU KETAHUAN.mov_2023-11-18 10:18:38,2023-11-18,35289,3208,6618,5332,11,0.21,0,0,IDR
K | ABO | 18-11-2023 | scale out,Ad group 20231118101735,BARU KETAHUAN.mov_2023-11-18 10:18:38,2023-11-19,53667,1987,8035,6679,27,0.4,0,0,IDR
K | ABO | 18-11-2023 | scale out,Ad group 20231118101735,BARU KETAHUAN.mov_2023-11-18 10:18:38,2023-11-20,40692,2393,7049,5772,17,0.29,1,40692,IDR
K | ABO | 18-11-2023 | scale out,Ad group 20231118101735,BARU KETAHUAN.mov_2023-11-18 10:18:38,2023-11-21,14564,7282,7278,2001,2,0.1,0,0,IDR
K | ABO | 18-11-2023 | scale out,Ad group 20231118101735,BARU KETAHUAN.mov_2023-11-18 10:18:38,2023-11-22,3586,1793,7229,496,2,0.4,0,0,IDR
K | ABO | 18-11-2023 | scale out,Ad group 20231118101735,BARU KETAHUAN.mov_2023-11-18 10:18:38,2023-11-23,0,0,0,0,0,0.0,0,0,IDR
